saved_models/resnet_cifar10_fp16_build_log.txt
[05/19/2024-17:32:55] [V] [TRT] *************** Autotuning format combination: Float(3072,1024,32,1) -> Float(16384,256,16,1) ***************
[05/19/2024-17:32:55] [V] [TRT] --------------- Timing Runner: /conv1/Conv + /relu/Relu (CaskConvolution[0x80000009])
[05/19/2024-17:32:55] [V] [TRT] Tactic Name: ampere_scudnn_128x64_relu_xregs_large_nn_v1 Tactic: 0x5deb29b7a8e275f7 Time: 0.0238438
[05/19/2024-17:32:55] [V] [TRT] Tactic Name: ampere_scudnn_128x128_relu_medium_nn_v1 Tactic: 0xf067e6205da31c2e Time: 0.0283063
[05/19/2024-17:32:55] [V] [TRT] Tactic Name: sm80_xmma_fprop_implicit_gemm_indexed_f32f32_f32f32_f32_nchwkcrs_nchw_tilesize128x64x8_stage2_warpsize1x4x1_g1_ffma_aligna4_alignc4_beta0_packed_stride Tactic: 0xede36641840ce3d2 Time: 0.0209398
[05/19/2024-17:32:55] [V] [TRT] Tactic Name: sm80_xmma_fprop_implicit_gemm_indexed_f32f32_f32f32_f32_nchwkcrs_nchw_tilesize128x32x8_stage3_warpsize2x2x1_g1_ffma_aligna4_alignc4 Tactic: 0xa9366041633a5135 Time: 0.016384
[05/19/2024-17:32:55] [V] [TRT] Tactic Name: sm80_xmma_fprop_implicit_gemm_indexed_f32f32_f32f32_f32_nchwkcrs_nchw_tilesize128x64x8_stage2_warpsize4x1x1_g1_ffma_aligna4_alignc4_beta0_packed_stride Tactic: 0x1673e3594ce11cea Time: 0.0227474
[05/19/2024-17:32:55] [V] [TRT] Tactic Name: sm80_xmma_fprop_implicit_gemm_indexed_f32f32_f32f32_f32_nchwkcrs_nchw_tilesize32x32x8_stage3_warpsize1x2x1_g1_ffma_aligna4_alignc4 Tactic: 0xcb8a43f748d8a338 Time: 0.0105656
[05/19/2024-17:32:55] [V] [TRT] Tactic Name: sm80_xmma_fprop_implicit_gemm_indexed_f32f32_f32f32_f32_nchwkcrs_nchw_tilesize128x16x8_stage3_warpsize4x1x1_g1_ffma_aligna4_alignc4 Tactic: 0x40a12e3938221818 Time: 0.0141831
[05/19/2024-17:32:55] [V] [TRT] Tactic Name: sm80_xmma_fprop_implicit_gemm_indexed_f32f32_f32f32_f32_nchwkcrs_nchw_tilesize64x64x8_stage3_warpsize1x4x1_g1_ffma_aligna4_alignc4 Tactic: 0xd828f024626fa982 Time: 0.0121371
[05/19/2024-17:32:55] [V] [TRT] Tactic Name: sm80_xmma_fprop_implicit_gemm_indexed_f32f32_f32f32_f32_nchwkcrs_nchw_tilesize128x64x8_stage2_warpsize2x2x1_g1_ffma_aligna4_alignc4_beta0_packed_stride Tactic: 0x31aa67f57c5aea77 Time: 0.0210038
[05/19/2024-17:32:55] [V] [TRT] Tactic Name: ampere_scudnn_128x64_relu_medium_nn_v1 Tactic: 0xf64396b97c889179 Time: 0.0253547
[05/19/2024-17:32:55] [V] [TRT] Tactic Name: sm50_xmma_conv_fprop_fused_conv_act_fp32_NCHW_fp32_NCHW_KCRS_fp32_fp32_fp32_Accfloat_1_1_cC1_dC1_srcVec1_fltVec1_1_TP3_TQ4_C1_R7_S7_U2_V2 Tactic: 0x0a617a3531b5b6dc Time: 0.00807213
[05/19/2024-17:32:55] [V] [TRT] Tactic Name: sm50_xmma_conv_fprop_fused_conv_act_fp32_NCHW_fp32_NCHW_KCRS_fp32_fp32_fp32_Accfloat_1_1_cC1_dC1_srcVec1_fltVec2_2_TP3_TQ4_C1_R7_S7_U2_V2 Tactic: 0x520e893be7313ed2 Time: 0.009196
[05/19/2024-17:32:55] [V] [TRT] /conv1/Conv + /relu/Relu (CaskConvolution[0x80000009]) profiling completed in 0.10547 seconds. Fastest Tactic: 0x0a617a3531b5b6dc Time: 0.00807213
[05/19/2024-17:32:55] [V] [TRT] --------------- Timing Runner: /conv1/Conv + /relu/Relu (CaskFlattenConvolution[0x80000036])
[05/19/2024-17:32:55] [V] [TRT] CaskFlattenConvolution has no valid tactics for this config, skipping
[05/19/2024-17:32:55] [V] [TRT] --------------- Timing Runner: /conv1/Conv + /relu/Relu (CudnnConvolution[0x80000000])
[05/19/2024-17:32:55] [V] [TRT] CudnnConvolution has no valid tactics for this config, skipping
[05/19/2024-17:32:55] [V] [TRT] >>>>>>>>>>>>>>> Chose Runner Type: CaskConvolution Tactic: 0x0a617a3531b5b6dc
[05/19/2024-17:32:55] [V] [TRT] *************** Autotuning format combination: Float(3072,1,96,3) -> Float(16384,1,1024,64) ***************
[05/19/2024-17:32:55] [V] [TRT] --------------- Timing Runner: /conv1/Conv + /relu/Relu (CaskConvolution[0x80000009])
[05/19/2024-17:32:55] [V] [TRT] Tactic Name: sm80_xmma_fprop_implicit_gemm_indexed_f32f32_f32f32_f32_nhwckrsc_nhwc_tilesize64x64x8_stage3_warpsize1x4x1_g1_ffma_aligna4_alignc4 Tactic: 0x19b688348f983aa0 Time: 0.0209607
[05/19/2024-17:32:55] [V] [TRT] Tactic Name: sm80_xmma_fprop_implicit_gemm_indexed_wo_smem_f32f32_tf32f32_f32_nhwckrsc_nhwc_tilesize128x16x32_stage1_warpsize4x1x1_g1_tensor16x8x8_aligna4_alignc4 Tactic: 0xcf8ea142095f02d2 Time: 0.0120244
[05/19/2024-17:32:55] [V] [TRT] Tactic Name: sm80_xmma_fprop_implicit_gemm_indexed_f32f32_f32f32_f32_nhwckrsc_nhwc_tilesize128x16x8_stage3_warpsize4x1x1_g1_ffma_aligna4_alignc4 Tactic: 0x4fd3c46622e98342 Time: 0.0238446
[05/19/2024-17:32:55] [V] [TRT] Tactic Name: sm80_xmma_fprop_implicit_gemm_indexed_wo_smem_f32f32_tf32f32_f32_nhwckrsc_nhwc_tilesize128x32x16_stage1_warpsize4x1x1_g1_tensor16x8x8_aligna4_alignc4 Tactic: 0xf231cca3335919a4 Time: 0.0143799
[05/19/2024-17:32:55] [V] [TRT] Tactic Name: sm80_xmma_fprop_implicit_gemm_indexed_f32f32_f32f32_f32_nhwckrsc_nhwc_tilesize32x32x8_stage3_warpsize1x2x1_g1_ffma_aligna4_alignc4 Tactic: 0x0a143be7a52f301a Time: 0.0159421
[05/19/2024-17:32:55] [V] [TRT] Tactic Name: sm80_xmma_fprop_implicit_gemm_indexed_f32f32_f32f32_f32_nhwckrsc_nhwc_tilesize128x32x8_stage3_warpsize2x2x1_g1_ffma_aligna4_alignc4 Tactic: 0xa6448a1e79f1ca6f Time: 0.0246248
[05/19/2024-17:32:55] [V] [TRT] /conv1/Conv + /relu/Relu (CaskConvolution[0x80000009]) profiling completed in 0.0131611 seconds. Fastest Tactic: 0xcf8ea142095f02d2 Time: 0.0120244
[05/19/2024-17:32:55] [V] [TRT] --------------- Timing Runner: /conv1/Conv + /relu/Relu (CaskFlattenConvolution[0x80000036])
[05/19/2024-17:32:55] [V] [TRT] CaskFlattenConvolution has no valid tactics for this config, skipping
[05/19/2024-17:32:55] [V] [TRT] >>>>>>>>>>>>>>> Chose Runner Type: CaskConvolution Tactic: 0xcf8ea142095f02d2
[05/19/2024-17:32:55] [V] [TRT] *************** Autotuning format combination: Float(1024,1:4,32,1) -> Float(16384,256,16,1) ***************
[05/19/2024-17:32:55] [V] [TRT] --------------- Timing Runner: /conv1/Conv + /relu/Relu (CaskConvolution[0x80000009])
[05/19/2024-17:32:55] [V] [TRT] Tactic Name: sm80_xmma_fprop_implicit_gemm_indexed_f32f32_tf32f32_f32_nhwckrsc_nchw_tilesize128x128x16_stage4_warpsize2x2x1_g1_tensor16x8x8_alignc4 Tactic: 0xe8f7b6a5bab325f8 Time: 0.0722651
[05/19/2024-17:32:55] [V] [TRT] Tactic Name: sm80_xmma_fprop_implicit_gemm_indexed_f32f32_tf32f32_f32_nhwckrsc_nchw_tilesize128x128x16_stage4_warpsize2x2x1_g1_tensor16x8x8 Tactic: 0xe0a307ffe0ffb6a5 Time: 0.0699246
[05/19/2024-17:32:55] [V] [TRT] /conv1/Conv + /relu/Relu (CaskConvolution[0x80000009]) profiling completed in 0.00510418 seconds. Fastest Tactic: 0xe0a307ffe0ffb6a5 Time: 0.0699246
[05/19/2024-17:32:55] [V] [TRT] --------------- Timing Runner: /conv1/Conv + /relu/Relu (CaskFlattenConvolution[0x80000036])
[05/19/2024-17:32:55] [V] [TRT] CaskFlattenConvolution has no valid tactics for this config, skipping
[05/19/2024-17:32:55] [V] [TRT] >>>>>>>>>>>>>>> Chose Runner Type: CaskConvolution Tactic: 0xe0a307ffe0ffb6a5
[05/19/2024-17:32:55] [V] [TRT] *************** Autotuning format combination: Float(1024,1:4,32,1) -> Float(4096,1:4,256,16) ***************
[05/19/2024-17:32:55] [V] [TRT] --------------- Timing Runner: /conv1/Conv + /relu/Relu (CaskConvolution[0x80000009])
[05/19/2024-17:32:55] [V] [TRT] Tactic Name: ampere_scudnn_128x128_ldg4_relu_exp_medium_nhwc_tn_v1 Tactic: 0x7bc32c782b800c48 Time: 0.0560213
[05/19/2024-17:32:55] [V] [TRT] Tactic Name: ampere_scudnn_128x64_sliced1x2_ldg4_relu_exp_large_nhwc_tn_v1 Tactic: 0xbdfdef6b84f7ccc9 Time: 0.0625615
[05/19/2024-17:32:55] [V] [TRT] Tactic Name: sm80_xmma_fprop_implicit_gemm_indexed_wo_smem_f32f32_tf32f32_f32_nhwckrsc_nhwc_tilesize128x16x32_stage1_warpsize4x1x1_g1_tensor16x8x8_alignc8 Tactic: 0x96467934a22da27d Time: 0.0126171
[05/19/2024-17:32:55] [V] [TRT] Tactic Name: sm80_xmma_fprop_implicit_gemm_indexed_wo_smem_f32f32_tf32f32_f32_nhwckrsc_nhwc_tilesize128x32x64_stage1_warpsize4x1x1_g1_tensor16x8x8_aligna8 Tactic: 0x9355e195cee05798 Time: 0.0133822
[05/19/2024-17:32:55] [V] [TRT] Tactic Name: sm80_xmma_fprop_implicit_gemm_indexed_wo_smem_f32f32_tf32f32_f32_nhwckrsc_nhwc_tilesize128x32x64_stage1_warpsize4x1x1_g1_tensor16x8x8_alignc8 Tactic: 0x3a8712b17741b582 Time: 0.0112753
[05/19/2024-17:32:55] [V] [TRT] Tactic Name: sm80_xmma_fprop_implicit_gemm_indexed_wo_smem_f32f32_tf32f32_f32_nhwckrsc_nhwc_tilesize128x16x32_stage1_warpsize4x1x1_g1_tensor16x8x8_aligna4 Tactic: 0xb3e5ce9d1b1da232 Time: 0.0168879
[05/19/2024-17:32:55] [V] [TRT] Tactic Name: sm80_xmma_fprop_implicit_gemm_indexed_wo_smem_f32f32_tf32f32_f32_nhwckrsc_nhwc_tilesize128x32x64_stage1_warpsize4x1x1_g1_tensor16x8x8_alignc4 Tactic: 0xb6f6563c77d057d7 Time: 0.0119718
[05/19/2024-17:32:55] [V] [TRT] Tactic Name: sm80_xmma_fprop_implicit_gemm_indexed_wo_smem_f32f32_tf32f32_f32_nhwckrsc_nhwc_tilesize128x16x64_stage1_warpsize4x1x1_g1_tensor16x8x8_aligna8 Tactic: 0xe9e5475c77d60638 Time: 0.0138942
[05/19/2024-17:32:55] [V] [TRT] Tactic Name: sm80_xmma_fprop_implicit_gemm_indexed_wo_smem_f32f32_tf32f32_f32_nhwckrsc_nhwc_tilesize128x16x32_stage1_warpsize4x1x1_g1_tensor16x8x8_aligna4_alignc8 Tactic: 0x43ffe5cf09cee087 Time: 0.0149198
[05/19/2024-17:32:55] [V] [TRT] Tactic Name: sm80_xmma_fprop_implicit_gemm_indexed_wo_smem_f32f32_tf32f32_f32_nhwckrsc_nhwc_tilesize128x16x32_stage1_warpsize4x1x1_g1_tensor16x8x8_aligna8_alignc8 Tactic: 0x4640eb34c8ecc700 Time: 0.0168391
[05/19/2024-17:32:55] [V] [TRT] Tactic Name: sm80_xmma_fprop_implicit_gemm_indexed_wo_smem_f32f32_tf32f32_f32_nhwckrsc_nhwc_tilesize128x16x32_stage1_warpsize4x1x1_g1_tensor16x8x8_aligna8 Tactic: 0x3f948a101b8c4067 Time: 0.0159594
[05/19/2024-17:32:55] [V] [TRT] Tactic Name: sm80_xmma_fprop_implicit_gemm_indexed_wo_smem_f32f32_tf32f32_f32_nhwckrsc_nhwc_tilesize128x32x16_stage1_warpsize4x1x1_g1_tensor16x8x8_alignc4 Tactic: 0xfed494d61b2087ba Time: 0.0138228
[05/19/2024-17:32:55] [V] [TRT] Tactic Name: sm80_xmma_fprop_implicit_gemm_indexed_wo_smem_f32f32_tf32f32_f32_nhwckrsc_nhwc_tilesize128x32x16_stage1_warpsize4x1x1_g1_tensor16x8x8_alignc8 Tactic: 0x72a5d05b1bb165ef Time: 0.013201
[05/19/2024-17:32:55] [V] [TRT] Tactic Name: sm80_xmma_fprop_implicit_gemm_indexed_wo_smem_f32f32_tf32f32_f32_nhwckrsc_nhwc_tilesize128x32x16_stage1_warpsize4x1x1_g1_tensor16x8x8 Tactic: 0x9cb304e2edbc1221 Time: 0.0131865
[05/19/2024-17:32:55] [V] [TRT] Tactic Name: sm80_xmma_fprop_implicit_gemm_indexed_wo_smem_f32f32_tf32f32_f32_nhwckrsc_nhwc_tilesize128x32x16_stage1_warpsize4x1x1_g1_tensor16x8x8_aligna8_alignc4 Tactic: 0xf78ec258f27b3e23 Time: 0.0239421
[05/19/2024-17:32:55] [V] [TRT] Tactic Name: sm80_xmma_fprop_implicit_gemm_indexed_wo_smem_f32f32_tf32f32_f32_nhwckrsc_nhwc_tilesize128x32x64_stage1_warpsize4x1x1_g1_tensor16x8x8_aligna4_alignc8 Tactic: 0x1acd4f006848c62b Time: 0.019944
[05/19/2024-17:32:55] [V] [TRT] Tactic Name: sm80_xmma_fprop_implicit_gemm_indexed_wo_smem_f32f32_tf32f32_f32_nhwckrsc_nhwc_tilesize128x16x64_stage1_warpsize4x1x1_g1_tensor16x8x8_alignc4 Tactic: 0xcc46f0f5cee60677 Time: 0.00862306
[05/19/2024-17:32:55] [V] [TRT] Tactic Name: sm80_xmma_fprop_implicit_gemm_indexed_wo_smem_f32f32_tf32f32_f32_nhwckrsc_nhwc_tilesize128x32x16_stage1_warpsize4x1x1_g1_tensor16x8x8_aligna4_alignc8 Tactic: 0x7e40882e33c8fbf1 Time: 0.0168229
[05/19/2024-17:32:55] [V] [TRT] Tactic Name: sm80_xmma_fprop_implicit_gemm_indexed_wo_smem_f32f32_tf32f32_f32_nhwckrsc_nhwc_tilesize128x16x64_stage1_warpsize4x1x1_g1_tensor16x8x8_alignc8 Tactic: 0x4037b478ce77e422 Time: 0.0106619
[05/19/2024-17:32:55] [V] [TRT] Tactic Name: sm80_xmma_fprop_implicit_gemm_indexed_wo_smem_f32f32_tf32f32_f32_nhwckrsc_nhwc_tilesize128x16x32_stage1_warpsize4x1x1_g1_tensor16x8x8_alignc4 Tactic: 0x1a373db9a2bc4028 Time: 0.0129573
[05/19/2024-17:32:55] [V] [TRT] Tactic Name: sm80_xmma_fprop_implicit_gemm_indexed_wo_smem_f32f32_tf32f32_f32_nhwckrsc_nhwc_tilesize128x16x64_stage1_warpsize4x1x1_g1_tensor16x8x8 Tactic: 0x10383a0781d24dde Time: 0.00815594
[05/19/2024-17:32:55] [V] [TRT] Tactic Name: sm80_xmma_fprop_implicit_gemm_indexed_wo_smem_f32f32_tf32f32_f32_nhwckrsc_nhwc_tilesize128x32x16_stage1_warpsize4x1x1_g1_tensor16x8x8_aligna8_alignc8 Tactic: 0x7bff86d5f2eadc76 Time: 0.0232594
[05/19/2024-17:32:55] [V] [TRT] Tactic Name: sm80_xmma_fprop_implicit_gemm_indexed_wo_smem_f32f32_tf32f32_f32_nhwckrsc_nhwc_tilesize128x32x64_stage1_warpsize4x1x1_g1_tensor16x8x8 Tactic: 0xb33296dda7141c64 Time: 0.0118738
[05/19/2024-17:32:55] [V] [TRT] Tactic Name: sm80_xmma_fprop_implicit_gemm_indexed_wo_smem_f32f32_tf32f32_f32_nhwckrsc_nhwc_tilesize128x32x16_stage1_warpsize4x1x1_g1_tensor16x8x8_aligna4 Tactic: 0x570667f2a28165a0 Time: 0.0165907
[05/19/2024-17:32:55] [V] [TRT] Tactic Name: sm80_xmma_fprop_implicit_gemm_indexed_wo_smem_f32f32_tf32f32_f32_nhwckrsc_nhwc_tilesize128x32x64_stage1_warpsize4x1x1_g1_tensor16x8x8_aligna8_alignc4 Tactic: 0x93030576a9fb03f9 Time: 0.0142013
[05/19/2024-17:32:55] [V] [TRT] Tactic Name: sm80_xmma_fprop_implicit_gemm_indexed_f32f32_tf32f32_f32_nhwckrsc_nhwc_tilesize128x128x16_stage4_warpsize2x2x1_g1_tensor16x8x8 Tactic: 0x65e41d81f093b482 Time: 0.0708053
[05/19/2024-17:32:55] [V] [TRT] Tactic Name: sm80_xmma_fprop_implicit_gemm_indexed_wo_smem_f32f32_tf32f32_f32_nhwckrsc_nhwc_tilesize128x16x64_stage1_warpsize4x1x1_g1_tensor16x8x8_aligna4_alignc8 Tactic: 0x22cadc265a3b2e32 Time: 0.0161402
[05/19/2024-17:32:55] [V] [TRT] Tactic Name: sm80_xmma_fprop_implicit_gemm_indexed_wo_smem_f32f32_tf32f32_f32_nhwckrsc_nhwc_tilesize128x16x64_stage1_warpsize4x1x1_g1_tensor16x8x8_aligna8_alignc4 Tactic: 0xab0496509b88ebe0 Time: 0.0142171
[05/19/2024-17:32:55] [V] [TRT] Tactic Name: sm80_xmma_fprop_implicit_gemm_indexed_wo_smem_f32f32_tf32f32_f32_nhwckrsc_nhwc_tilesize128x32x16_stage1_warpsize4x1x1_g1_tensor16x8x8_aligna8 Tactic: 0xdb77237fa21087f5 Time: 0.0230087
[05/19/2024-17:32:55] [V] [TRT] Tactic Name: sm80_xmma_fprop_implicit_gemm_indexed_wo_smem_f32f32_tf32f32_f32_nhwckrsc_nhwc_tilesize128x16x32_stage1_warpsize4x1x1_g1_tensor16x8x8 Tactic: 0xae48d3ccfe1edfcd Time: 0.00930657
[05/19/2024-17:32:55] [V] [TRT] /conv1/Conv + /relu/Relu (CaskConvolution[0x80000009]) profiling completed in 0.0628702 seconds. Fastest Tactic: 0x10383a0781d24dde Time: 0.00815594
[05/19/2024-17:32:55] [V] [TRT] --------------- Timing Runner: /conv1/Conv + /relu/Relu (CaskFlattenConvolution[0x80000036])
[05/19/2024-17:32:55] [V] [TRT] CaskFlattenConvolution has no valid tactics for this config, skipping
[05/19/2024-17:32:55] [V] [TRT] >>>>>>>>>>>>>>> Chose Runner Type: CaskConvolution Tactic: 0x10383a0781d24dde
[05/19/2024-17:32:55] [V] [TRT] *************** Autotuning format combination: Half(3072,1024,32,1) -> Half(16384,256,16,1) ***************
[05/19/2024-17:32:55] [V] [TRT] --------------- Timing Runner: /conv1/Conv + /relu/Relu (CaskConvolution[0x80000009])
[05/19/2024-17:32:55] [V] [TRT] CaskConvolution has no valid tactics for this config, skipping
[05/19/2024-17:32:55] [V] [TRT] --------------- Timing Runner: /conv1/Conv + /relu/Relu (CaskFlattenConvolution[0x80000036])
[05/19/2024-17:32:55] [V] [TRT] CaskFlattenConvolution has no valid tactics for this config, skipping
[05/19/2024-17:32:55] [V] [TRT] --------------- Timing Runner: /conv1/Conv + /relu/Relu (CudnnConvolution[0x80000000])
[05/19/2024-17:32:55] [V] [TRT] CudnnConvolution has no valid tactics for this config, skipping
[05/19/2024-17:32:55] [V] [TRT] *************** Autotuning format combination: Half(2048,1:2,64,2) -> Half(8192,1:2,512,32) ***************
[05/19/2024-17:32:55] [V] [TRT] --------------- Timing Runner: /conv1/Conv + /relu/Relu (CaskConvolution[0x80000009])
[05/19/2024-17:32:55] [V] [TRT] Tactic Name: sm80_xmma_fprop_implicit_gemm_indexed_wo_smem_f16f16_f16f16_f16_nhwckrsc_nhwc_tilesize128x32x64_stage1_warpsize4x1x1_g1_tensor16x8x16_aligna2_alignc4 Tactic: 0x6a76904d34985d11 Time: 0.0158801
[05/19/2024-17:32:55] [V] [TRT] Tactic Name: sm80_xmma_fprop_implicit_gemm_indexed_wo_smem_f16f16_f16f16_f16_nhwckrsc_nhwc_tilesize128x32x16_stage1_warpsize4x1x1_g1_tensor16x8x16_aligna2_alignc4 Tactic: 0xb97671b320ea2fbb Time: 0.0156178
[05/19/2024-17:32:55] [V] [TRT] Tactic Name: sm80_xmma_fprop_implicit_gemm_indexed_wo_smem_f16f16_f16f16_f16_nhwckrsc_nhwc_tilesize128x32x64_stage1_warpsize4x1x1_g1_tensor16x8x16_aligna2_alignc2 Tactic: 0xe522659e6357a379 Time: 0.0169204
[05/19/2024-17:32:55] [V] [TRT] Tactic Name: sm80_xmma_fprop_implicit_gemm_indexed_wo_smem_f16f16_f16f16_f16_nhwckrsc_nhwc_tilesize128x16x64_stage1_warpsize4x1x1_g1_tensor16x8x16_aligna4_alignc2 Tactic: 0x17bdd86adff94950 Time: 0.010206
[05/19/2024-17:32:55] [V] [TRT] Tactic Name: sm80_xmma_fprop_implicit_gemm_indexed_wo_smem_f16f16_f16f16_f16_nhwckrsc_nhwc_tilesize128x16x32_stage1_warpsize4x1x1_g1_tensor16x8x16_aligna2_alignc4 Tactic: 0xd405f38f8e89fab2 Time: 0.0130801
[05/19/2024-17:32:55] [V] [TRT] Tactic Name: sm80_xmma_fprop_implicit_gemm_indexed_wo_smem_f16f16_f16f16_f16_nhwckrsc_nhwc_tilesize128x32x16_stage1_warpsize4x1x1_g1_tensor16x8x16_aligna2_alignc2 Tactic: 0x362284607725d1d3 Time: 0.0166766
[05/19/2024-17:32:55] [V] [TRT] Tactic Name: sm80_xmma_fprop_implicit_gemm_indexed_wo_smem_f16f16_f16f16_f16_nhwckrsc_nhwc_tilesize128x32x16_stage1_warpsize4x1x1_g1_tensor16x8x16_aligna4_alignc2 Tactic: 0xfd9154884033cd52 Time: 0.0109133
[05/19/2024-17:32:55] [V] [TRT] Tactic Name: sm80_xmma_fprop_implicit_gemm_indexed_wo_smem_f16f16_f16f16_f16_nhwckrsc_nhwc_tilesize128x32x64_stage1_warpsize4x1x1_g1_tensor16x8x16_aligna4_alignc4 Tactic: 0xa1c540a5038e4190 Time: 0.00943457
[05/19/2024-17:32:55] [V] [TRT] Tactic Name: sm80_xmma_fprop_implicit_gemm_indexed_wo_smem_f16f16_f16f16_f16_nhwckrsc_nhwc_tilesize128x16x32_stage1_warpsize4x1x1_g1_tensor16x8x16_aligna4_alignc2 Tactic: 0x90e2d6b4ee50185b Time: 0.00961249
[05/19/2024-17:32:55] [V] [TRT] Tactic Name: sm80_xmma_fprop_implicit_gemm_indexed_wo_smem_f16f16_f16f16_f16_nhwckrsc_nhwc_tilesize128x16x64_stage1_warpsize4x1x1_g1_tensor16x8x16_aligna4_alignc4 Tactic: 0x98e92db98836b738 Time: 0.00760397
[05/19/2024-17:32:55] [V] [TRT] Tactic Name: sm80_xmma_fprop_image_first_layer_f16f16_f32_f16_nhwckrsc_nhwc_hmma_k64c4r7s7_stride2x2_tile16x64x64_tensor1688 Tactic: 0x4341b9cbb7197a9b Time: 0.0427154
[05/19/2024-17:32:55] [V] [TRT] Tactic Name: sm80_xmma_fprop_implicit_gemm_indexed_wo_smem_f16f16_f16f16_f16_nhwckrsc_nhwc_tilesize128x16x64_stage1_warpsize4x1x1_g1_tensor16x8x16_aligna2_alignc4 Tactic: 0x535afd51bf20abb9 Time: 0.0147749
[05/19/2024-17:32:55] [V] [TRT] Tactic Name: sm80_xmma_fprop_implicit_gemm_indexed_wo_smem_f16f16_f16f16_f16_nhwckrsc_nhwc_tilesize128x32x64_stage1_warpsize4x1x1_g1_tensor16x8x16_aligna4_alignc2 Tactic: 0x2e91b5765441bff8 Time: 0.0102162
[05/19/2024-17:32:55] [V] [TRT] Tactic Name: sm80_xmma_fprop_implicit_gemm_indexed_wo_smem_f16f16_f16f16_f16_nhwckrsc_nhwc_tilesize128x16x32_stage1_warpsize4x1x1_g1_tensor16x8x16_aligna2_alignc2 Tactic: 0x5b51065cd94604da Time: 0.0135019
[05/19/2024-17:32:55] [V] [TRT] Tactic Name: sm80_xmma_fprop_implicit_gemm_indexed_wo_smem_f16f16_f16f16_f16_nhwckrsc_nhwc_tilesize128x16x64_stage1_warpsize4x1x1_g1_tensor16x8x16_aligna2_alignc2 Tactic: 0xdc0e0882e8ef55d1 Time: 0.0151991
[05/19/2024-17:32:55] [V] [TRT] Tactic Name: sm80_xmma_fprop_implicit_gemm_indexed_wo_smem_f16f16_f16f16_f16_nhwckrsc_nhwc_tilesize128x32x16_stage1_warpsize4x1x1_g1_tensor16x8x16_aligna4_alignc4 Tactic: 0x72c5a15b17fc333a Time: 0.0102047
[05/19/2024-17:32:55] [V] [TRT] Tactic Name: sm80_xmma_fprop_implicit_gemm_indexed_wo_smem_f16f16_f16f16_f16_nhwckrsc_nhwc_tilesize128x16x32_stage1_warpsize4x1x1_g1_tensor16x8x16_aligna4_alignc4 Tactic: 0x1fb62367b99fe633 Time: 0.00834845
[05/19/2024-17:32:55] [V] [TRT] /conv1/Conv + /relu/Relu (CaskConvolution[0x80000009]) profiling completed in 0.0364765 seconds. Fastest Tactic: 0x98e92db98836b738 Time: 0.00760397
[05/19/2024-17:32:55] [V] [TRT] --------------- Timing Runner: /conv1/Conv + /relu/Relu (CaskFlattenConvolution[0x80000036])
[05/19/2024-17:32:55] [V] [TRT] CaskFlattenConvolution has no valid tactics for this config, skipping
[05/19/2024-17:32:55] [V] [TRT] >>>>>>>>>>>>>>> Chose Runner Type: CaskConvolution Tactic: 0x98e92db98836b738
[05/19/2024-17:32:55] [V] [TRT] *************** Autotuning format combination: Half(1024,1:4,32,1) -> Half(4096,1:4,256,16) ***************
[05/19/2024-17:32:55] [V] [TRT] --------------- Timing Runner: /conv1/Conv + /relu/Relu (CaskConvolution[0x80000009])
[05/19/2024-17:32:55] [V] [TRT] CaskConvolution has no valid tactics for this config, skipping
[05/19/2024-17:32:55] [V] [TRT] --------------- Timing Runner: /conv1/Conv + /relu/Relu (CaskFlattenConvolution[0x80000036])
[05/19/2024-17:32:55] [V] [TRT] CaskFlattenConvolution has no valid tactics for this config, skipping
[05/19/2024-17:32:55] [V] [TRT] *************** Autotuning format combination: Half(1024,1:4,32,1) -> Half(2048,1:8,128,8) ***************
[05/19/2024-17:32:55] [V] [TRT] --------------- Timing Runner: /conv1/Conv + /relu/Relu (CaskConvolution[0x80000009])
[05/19/2024-17:32:55] [V] [TRT] Tactic Name: sm80_xmma_fprop_implicit_gemm_indexed_wo_smem_f16f16_f16f16_f16_nhwckrsc_nhwc_tilesize128x16x64_stage1_warpsize4x1x1_g1_tensor16x8x16_aligna8_alignc4 Tactic: 0x9d562342491490bf Time: 0.00775242
[05/19/2024-17:32:55] [V] [TRT] Tactic Name: sm80_xmma_fprop_implicit_gemm_indexed_wo_smem_f16f16_f16f16_f16_nhwckrsc_nhwc_tilesize128x32x64_stage1_warpsize4x1x1_g1_tensor16x8x16_aligna8_alignc8 Tactic: 0x280b0ad3c23d8442 Time: 0.00843187
[05/19/2024-17:32:55] [V] [TRT] Tactic Name: sm80_xmma_fprop_implicit_gemm_indexed_wo_smem_f16f16_f16f16_f16_nhwckrsc_nhwc_tilesize128x32x64_stage1_warpsize4x1x1_g1_tensor16x8x16_aligna2_alignc4 Tactic: 0x6a76904d34985d11 Time: 0.0158546
[05/19/2024-17:32:55] [V] [TRT] Tactic Name: sm80_xmma_fprop_implicit_gemm_indexed_wo_smem_f16f16_f16f16_f16_nhwckrsc_nhwc_tilesize128x16x64_stage1_warpsize4x1x1_g1_tensor16x8x16_aligna4_alignc8 Tactic: 0x1498693488a7556d Time: 0.00703499
[05/19/2024-17:32:55] [V] [TRT] Tactic Name: sm80_xmma_fprop_implicit_gemm_indexed_wo_smem_f16f16_f16f16_f16_nhwckrsc_nhwc_tilesize128x32x16_stage1_warpsize4x1x1_g1_tensor16x8x16_aligna2_alignc4 Tactic: 0xb97671b320ea2fbb Time: 0.0156242
[05/19/2024-17:32:55] [V] [TRT] Tactic Name: sm80_xmma_fprop_implicit_gemm_indexed_wo_smem_f16f16_f16f16_f16_nhwckrsc_nhwc_tilesize128x16x64_stage1_warpsize4x1x1_g1_tensor16x8x16_aligna2_alignc8 Tactic: 0xdf2bb9dcbfb149ec Time: 0.0157842
[05/19/2024-17:32:55] [V] [TRT] Tactic Name: sm80_xmma_fprop_implicit_gemm_indexed_wo_smem_f16f16_f16f16_f16_nhwckrsc_nhwc_tilesize128x32x16_stage1_warpsize4x1x1_g1_tensor16x8x16_aligna8_alignc8 Tactic: 0xfb0beb2dd64ff6e8 Time: 0.0159782
[05/19/2024-17:32:55] [V] [TRT] Tactic Name: sm80_xmma_fprop_implicit_gemm_indexed_wo_smem_f16f16_f16f16_f16_nhwckrsc_nhwc_tilesize128x32x64_stage1_warpsize4x1x1_g1_tensor16x8x16_aligna2_alignc2 Tactic: 0xe522659e6357a379 Time: 0.0169189
[05/19/2024-17:32:55] [V] [TRT] Tactic Name: sm80_xmma_fprop_implicit_gemm_indexed_wo_smem_f16f16_f16f16_f16_nhwckrsc_nhwc_tilesize128x32x64_stage1_warpsize4x1x1_g1_tensor16x8x16_aligna8_alignc2 Tactic: 0x2b2ebb8d9563987f Time: 0.00878279
[05/19/2024-17:32:55] [V] [TRT] Tactic Name: sm80_xmma_fprop_implicit_gemm_indexed_wo_smem_f16f16_f16f16_f16_nhwckrsc_nhwc_tilesize128x16x64_stage1_warpsize4x1x1_g1_tensor16x8x16_aligna4_alignc2 Tactic: 0x17bdd86adff94950 Time: 0.010091
[05/19/2024-17:32:55] [V] [TRT] Tactic Name: sm80_xmma_fprop_implicit_gemm_indexed_wo_smem_f16f16_f16f16_f16_nhwckrsc_nhwc_tilesize128x16x32_stage1_warpsize4x1x1_g1_tensor16x8x16_aligna2_alignc4 Tactic: 0xd405f38f8e89fab2 Time: 0.0131366
[05/19/2024-17:32:55] [V] [TRT] Tactic Name: sm80_xmma_fprop_implicit_gemm_indexed_wo_smem_f16f16_f16f16_f16_nhwckrsc_nhwc_tilesize128x32x16_stage1_warpsize4x1x1_g1_tensor16x8x16_aligna2_alignc2 Tactic: 0x362284607725d1d3 Time: 0.0161402
[05/19/2024-17:32:55] [V] [TRT] Tactic Name: sm80_xmma_fprop_implicit_gemm_indexed_wo_smem_f16f16_f16f16_f16_nhwckrsc_nhwc_tilesize128x32x16_stage1_warpsize4x1x1_g1_tensor16x8x16_aligna4_alignc8 Tactic: 0xfeb4e5d6176dd16f Time: 0.0105819
[05/19/2024-17:32:55] [V] [TRT] Tactic Name: sm80_xmma_fprop_implicit_gemm_indexed_wo_smem_f16f16_f16f16_f16_nhwckrsc_nhwc_tilesize128x32x16_stage1_warpsize4x1x1_g1_tensor16x8x16_aligna4_alignc2 Tactic: 0xfd9154884033cd52 Time: 0.00943257
[05/19/2024-17:32:55] [V] [TRT] Tactic Name: sm80_xmma_fprop_implicit_gemm_indexed_wo_smem_f16f16_f16f16_f16_nhwckrsc_nhwc_tilesize128x32x64_stage1_warpsize4x1x1_g1_tensor16x8x16_aligna4_alignc4 Tactic: 0xa1c540a5038e4190 Time: 0.00816508
[05/19/2024-17:32:55] [V] [TRT] Tactic Name: sm80_xmma_fprop_implicit_gemm_indexed_wo_smem_f16f16_f16f16_f16_nhwckrsc_nhwc_tilesize128x32x64_stage1_warpsize4x1x1_g1_tensor16x8x16_aligna8_alignc4 Tactic: 0xa47a4e5ec2ac6617 Time: 0.00764126
[05/19/2024-17:32:55] [V] [TRT] Tactic Name: sm80_xmma_fprop_implicit_gemm_indexed_wo_smem_f16f16_f16f16_f16_nhwckrsc_nhwc_tilesize128x16x64_stage1_warpsize4x1x1_g1_tensor16x8x16_aligna8_alignc8 Tactic: 0x112767cf498572ea Time: 0.00565644
[05/19/2024-17:32:55] [V] [TRT] Tactic Name: sm80_xmma_fprop_implicit_gemm_indexed_wo_smem_f16f16_f16f16_f16_nhwckrsc_nhwc_tilesize128x16x32_stage1_warpsize4x1x1_g1_tensor16x8x16_aligna4_alignc2 Tactic: 0x90e2d6b4ee50185b Time: 0.00833626
[05/19/2024-17:32:55] [V] [TRT] Tactic Name: sm80_xmma_fprop_implicit_gemm_indexed_wo_smem_f16f16_f16f16_f16_nhwckrsc_nhwc_tilesize128x16x32_stage1_warpsize4x1x1_g1_tensor16x8x16_aligna8_alignc4 Tactic: 0x1a092d9c78bdc1b4 Time: 0.00794743
[05/19/2024-17:32:55] [V] [TRT] Tactic Name: sm80_xmma_fprop_implicit_gemm_indexed_wo_smem_f16f16_f16f16_f16_nhwckrsc_nhwc_tilesize128x16x64_stage1_warpsize4x1x1_g1_tensor16x8x16_aligna4_alignc4 Tactic: 0x98e92db98836b738 Time: 0.00655356
[05/19/2024-17:32:55] [V] [TRT] Tactic Name: sm80_xmma_fprop_image_first_layer_f16f16_f32_f16_nhwckrsc_nhwc_hmma_k64c4r7s7_stride2x2_tile16x64x64_tensor1688 Tactic: 0x4341b9cbb7197a9b Time: 0.0369006
[05/19/2024-17:32:55] [V] [TRT] Tactic Name: sm80_xmma_fprop_implicit_gemm_indexed_wo_smem_f16f16_f16f16_f16_nhwckrsc_nhwc_tilesize128x32x16_stage1_warpsize4x1x1_g1_tensor16x8x16_aligna2_alignc8 Tactic: 0x3507353e207bcdee Time: 0.0140684
[05/19/2024-17:32:55] [V] [TRT] Tactic Name: sm80_xmma_fprop_implicit_gemm_indexed_wo_smem_f16f16_f16f16_f16_nhwckrsc_nhwc_tilesize128x16x64_stage1_warpsize4x1x1_g1_tensor16x8x16_aligna8_alignc2 Tactic: 0x1202d6911edb6ed7 Time: 0.00711423
[05/19/2024-17:32:55] [V] [TRT] Tactic Name: sm80_xmma_fprop_implicit_gemm_indexed_wo_smem_f16f16_f16f16_f16_nhwckrsc_nhwc_tilesize128x32x16_stage1_warpsize4x1x1_g1_tensor16x8x16_aligna8_alignc2 Tactic: 0xf82e5a738111ead5 Time: 0.0150167
[05/19/2024-17:32:55] [V] [TRT] Tactic Name: sm80_xmma_fprop_implicit_gemm_indexed_wo_smem_f16f16_f16f16_f16_nhwckrsc_nhwc_tilesize128x32x64_stage1_warpsize4x1x1_g1_tensor16x8x16_aligna2_alignc8 Tactic: 0xe607d4c03409bf44 Time: 0.0120149
[05/19/2024-17:32:55] [V] [TRT] Tactic Name: sm80_xmma_fprop_implicit_gemm_indexed_wo_smem_f16f16_f16f16_f16_nhwckrsc_nhwc_tilesize128x16x64_stage1_warpsize4x1x1_g1_tensor16x8x16_aligna2_alignc4 Tactic: 0x535afd51bf20abb9 Time: 0.0127634
[05/19/2024-17:32:55] [V] [TRT] Tactic Name: sm80_xmma_fprop_implicit_gemm_indexed_wo_smem_f16f16_f16f16_f16_nhwckrsc_nhwc_tilesize128x32x64_stage1_warpsize4x1x1_g1_tensor16x8x16_aligna4_alignc2 Tactic: 0x2e91b5765441bff8 Time: 0.00883388
[05/19/2024-17:32:55] [V] [TRT] Tactic Name: sm80_xmma_fprop_implicit_gemm_indexed_wo_smem_f16f16_f16f16_f16_nhwckrsc_nhwc_tilesize128x16x32_stage1_warpsize4x1x1_g1_tensor16x8x16_aligna4_alignc8 Tactic: 0x93c767eab90e0466 Time: 0.00709856
[05/19/2024-17:32:55] [V] [TRT] Tactic Name: sm80_xmma_fprop_implicit_gemm_indexed_wo_smem_f16f16_f16f16_f16_nhwckrsc_nhwc_tilesize128x16x32_stage1_warpsize4x1x1_g1_tensor16x8x16_aligna2_alignc8 Tactic: 0x5874b7028e1818e7 Time: 0.0107272
[05/19/2024-17:32:55] [V] [TRT] Tactic Name: sm80_xmma_fprop_implicit_gemm_indexed_wo_smem_f16f16_f16f16_f16_nhwckrsc_nhwc_tilesize128x16x32_stage1_warpsize4x1x1_g1_tensor16x8x16_aligna8_alignc8 Tactic: 0x96786911782c23e1 Time: 0.00775507
[05/19/2024-17:32:55] [V] [TRT] Tactic Name: sm80_xmma_fprop_implicit_gemm_indexed_wo_smem_f16f16_f16f16_f16_nhwckrsc_nhwc_tilesize128x16x32_stage1_warpsize4x1x1_g1_tensor16x8x16_aligna2_alignc2 Tactic: 0x5b51065cd94604da Time: 0.011578
[05/19/2024-17:32:55] [V] [TRT] Tactic Name: sm80_xmma_fprop_implicit_gemm_indexed_wo_smem_f16f16_f16f16_f16_nhwckrsc_nhwc_tilesize128x16x64_stage1_warpsize4x1x1_g1_tensor16x8x16_aligna2_alignc2 Tactic: 0xdc0e0882e8ef55d1 Time: 0.0131208
[05/19/2024-17:32:55] [V] [TRT] Tactic Name: sm80_xmma_fprop_implicit_gemm_indexed_wo_smem_f16f16_f16f16_f16_nhwckrsc_nhwc_tilesize128x32x16_stage1_warpsize4x1x1_g1_tensor16x8x16_aligna8_alignc4 Tactic: 0x777aafa0d6de14bd Time: 0.0140842
[05/19/2024-17:32:55] [V] [TRT] Tactic Name: sm80_xmma_fprop_implicit_gemm_indexed_wo_smem_f16f16_f16f16_f16_nhwckrsc_nhwc_tilesize128x32x16_stage1_warpsize4x1x1_g1_tensor16x8x16_aligna4_alignc4 Tactic: 0x72c5a15b17fc333a Time: 0.00883227
[05/19/2024-17:32:55] [V] [TRT] Tactic Name: sm80_xmma_fprop_implicit_gemm_indexed_wo_smem_f16f16_f16f16_f16_nhwckrsc_nhwc_tilesize128x16x32_stage1_warpsize4x1x1_g1_tensor16x8x16_aligna4_alignc4 Tactic: 0x1fb62367b99fe633 Time: 0.00725394
[05/19/2024-17:32:55] [V] [TRT] Tactic Name: sm80_xmma_fprop_implicit_gemm_indexed_wo_smem_f16f16_f16f16_f16_nhwckrsc_nhwc_tilesize128x16x32_stage1_warpsize4x1x1_g1_tensor16x8x16_aligna8_alignc2 Tactic: 0x955dd84f2f723fdc Time: 0.00792445
[05/19/2024-17:32:55] [V] [TRT] Tactic Name: sm80_xmma_fprop_implicit_gemm_indexed_wo_smem_f16f16_f16f16_f16_nhwckrsc_nhwc_tilesize128x32x64_stage1_warpsize4x1x1_g1_tensor16x8x16_aligna4_alignc8 Tactic: 0x2db40428031fa3c5 Time: 0.00778081
[05/19/2024-17:32:55] [V] [TRT] /conv1/Conv + /relu/Relu (CaskConvolution[0x80000009]) profiling completed in 0.0747278 seconds. Fastest Tactic: 0x112767cf498572ea Time: 0.00565644
[05/19/2024-17:32:55] [V] [TRT] --------------- Timing Runner: /conv1/Conv + /relu/Relu (CaskFlattenConvolution[0x80000036])
[05/19/2024-17:32:55] [V] [TRT] CaskFlattenConvolution has no valid tactics for this config, skipping
[05/19/2024-17:32:55] [V] [TRT] >>>>>>>>>>>>>>> Chose Runner Type: CaskConvolution Tactic: 0x112767cf498572ea
[05/19/2024-17:32:55] [V] [TRT] *************** Autotuning format combination: Half(1024,1:8,32,1) -> Float(16384,256,16,1) ***************
[05/19/2024-17:32:55] [V] [TRT] --------------- Timing Runner: /conv1/Conv + /relu/Relu (CaskConvolution[0x80000009])
[05/19/2024-17:32:55] [V] [TRT] CaskConvolution has no valid tactics for this config, skipping
[05/19/2024-17:32:55] [V] [TRT] --------------- Timing Runner: /conv1/Conv + /relu/Relu (CaskFlattenConvolution[0x80000036])
[05/19/2024-17:32:55] [V] [TRT] CaskFlattenConvolution has no valid tactics for this config, skipping
[05/19/2024-17:32:55] [V] [TRT] *************** Autotuning format combination: Half(1024,1:8,32,1) -> Half(2048,1:8,128,8) ***************
[05/19/2024-17:32:55] [V] [TRT] --------------- Timing Runner: /conv1/Conv + /relu/Relu (CaskConvolution[0x80000009])
[05/19/2024-17:32:55] [V] [TRT] Tactic Name: sm80_xmma_fprop_implicit_gemm_indexed_f16f16_f16f16_f16_nhwckrsc_nhwc_tilesize256x32x32_stage4_warpsize4x1x1_g1_tensor16x8x16 Tactic: 0xdce100b9fe609424 Time: 0.0211696
[05/19/2024-17:32:55] [V] [TRT] Tactic Name: sm80_xmma_fprop_implicit_gemm_indexed_wo_smem_f16f16_f16f16_f16_nhwckrsc_nhwc_tilesize128x16x64_stage1_warpsize4x1x1_g1_tensor16x8x16_aligna8_alignc4 Tactic: 0x9d562342491490bf Time: 0.0098179
[05/19/2024-17:32:55] [V] [TRT] Tactic Name: sm80_xmma_fprop_implicit_gemm_indexed_wo_smem_f16f16_f16f16_f16_nhwckrsc_nhwc_tilesize128x32x64_stage1_warpsize4x1x1_g1_tensor16x8x16_alignc2 Tactic: 0x18d13b6b3c8edcbe Time: 0.00953265
[05/19/2024-17:32:55] [V] [TRT] Tactic Name: sm80_xmma_fprop_implicit_gemm_indexed_wo_smem_f16f16_f16f16_f16_nhwckrsc_nhwc_tilesize128x16x32_stage1_warpsize4x1x1_g1_tensor16x8x16_alignc8 Tactic: 0xfbf5ea2d8a6293cd Time: 0.00980419
[05/19/2024-17:32:55] [V] [TRT] Tactic Name: sm80_xmma_fprop_image_first_layer_f16f16_f32_f16_nhwckrsc_nhwc_hmma_k64c8r7s7_stride2x2_tile16x64x16_tensor1688 Tactic: 0x603af898ad7e47f4 Time: 0.022814
[05/19/2024-17:32:55] [V] [TRT] Tactic Name: sm80_xmma_fprop_implicit_gemm_indexed_wo_smem_f16f16_f16f16_f16_nhwckrsc_nhwc_tilesize128x32x64_stage1_warpsize4x1x1_g1_tensor16x8x16_aligna8_alignc8 Tactic: 0x280b0ad3c23d8442 Time: 0.0109518
[05/19/2024-17:32:55] [V] [TRT] Tactic Name: sm80_xmma_fprop_implicit_gemm_indexed_wo_smem_f16f16_f16f16_f16_nhwckrsc_nhwc_tilesize128x32x64_stage1_warpsize4x1x1_g1_tensor16x8x16_aligna2_alignc4 Tactic: 0x6a76904d34985d11 Time: 0.0222328
[05/19/2024-17:32:55] [V] [TRT] Tactic Name: sm80_xmma_fprop_implicit_gemm_indexed_wo_smem_f16f16_f16f16_f16_nhwckrsc_nhwc_tilesize128x16x64_stage1_warpsize4x1x1_g1_tensor16x8x16_aligna4_alignc8 Tactic: 0x1498693488a7556d Time: 0.00860854
[05/19/2024-17:32:55] [V] [TRT] Tactic Name: sm80_xmma_fprop_implicit_gemm_indexed_wo_smem_f16f16_f16f16_f16_nhwckrsc_nhwc_tilesize128x16x32_stage1_warpsize4x1x1_g1_tensor16x8x16_alignc2 Tactic: 0xf8d05b73dd3c8ff0 Time: 0.00905257
[05/19/2024-17:32:55] [V] [TRT] Tactic Name: sm80_xmma_fprop_implicit_gemm_indexed_wo_smem_f16f16_f16f16_f16_nhwckrsc_nhwc_tilesize128x32x16_stage1_warpsize4x1x1_g1_tensor16x8x16_aligna2_alignc4 Tactic: 0xb97671b320ea2fbb Time: 0.0231014
[05/19/2024-17:32:55] [V] [TRT] Tactic Name: sm80_xmma_fprop_implicit_gemm_indexed_wo_smem_f16f16_f16f16_f16_nhwckrsc_nhwc_tilesize128x16x64_stage1_warpsize4x1x1_g1_tensor16x8x16_aligna2_alignc8 Tactic: 0xdf2bb9dcbfb149ec Time: 0.0224758
[05/19/2024-17:32:55] [V] [TRT] Tactic Name: sm80_xmma_fprop_implicit_gemm_indexed_wo_smem_f16f16_f16f16_f16_nhwckrsc_nhwc_tilesize128x32x16_stage1_warpsize4x1x1_g1_tensor16x8x16_aligna8_alignc8 Tactic: 0xfb0beb2dd64ff6e8 Time: 0.0241676
[05/19/2024-17:32:55] [V] [TRT] Tactic Name: sm80_xmma_fprop_implicit_gemm_indexed_wo_smem_f16f16_f16f16_f16_nhwckrsc_nhwc_tilesize128x32x64_stage1_warpsize4x1x1_g1_tensor16x8x16_aligna2_alignc2 Tactic: 0xe522659e6357a379 Time: 0.0226984
[05/19/2024-17:32:55] [V] [TRT] Tactic Name: sm80_xmma_fprop_implicit_gemm_indexed_wo_smem_f16f16_f16f16_f16_nhwckrsc_nhwc_tilesize128x32x64_stage1_warpsize4x1x1_g1_tensor16x8x16_aligna8_alignc2 Tactic: 0x2b2ebb8d9563987f Time: 0.010305
[05/19/2024-17:32:55] [V] [TRT] Tactic Name: sm80_xmma_fprop_implicit_gemm_indexed_wo_smem_f16f16_f16f16_f16_nhwckrsc_nhwc_tilesize128x32x64_stage1_warpsize4x1x1_g1_tensor16x8x16_alignc4 Tactic: 0x9785ceb86b4122d6 Time: 0.00874864
[05/19/2024-17:32:55] [V] [TRT] Tactic Name: sm80_xmma_fprop_implicit_gemm_indexed_wo_smem_f16f16_f16f16_f16_nhwckrsc_nhwc_tilesize128x16x64_stage1_warpsize4x1x1_g1_tensor16x8x16_aligna4_alignc2 Tactic: 0x17bdd86adff94950 Time: 0.0130602
[05/19/2024-17:32:55] [V] [TRT] Tactic Name: sm80_xmma_fprop_implicit_gemm_indexed_wo_smem_f16f16_f16f16_f16_nhwckrsc_nhwc_tilesize128x16x32_stage1_warpsize4x1x1_g1_tensor16x8x16_aligna2_alignc4 Tactic: 0xd405f38f8e89fab2 Time: 0.0188126
[05/19/2024-17:32:55] [V] [TRT] Tactic Name: sm80_xmma_fprop_implicit_gemm_indexed_wo_smem_f16f16_f16f16_f16_nhwckrsc_nhwc_tilesize128x32x16_stage1_warpsize4x1x1_g1_tensor16x8x16_aligna2_alignc2 Tactic: 0x362284607725d1d3 Time: 0.0240061
[05/19/2024-17:32:55] [V] [TRT] Tactic Name: sm80_xmma_fprop_implicit_gemm_indexed_wo_smem_f16f16_f16f16_f16_nhwckrsc_nhwc_tilesize128x32x16_stage1_warpsize4x1x1_g1_tensor16x8x16_aligna4_alignc8 Tactic: 0xfeb4e5d6176dd16f Time: 0.0176163
[05/19/2024-17:32:55] [V] [TRT] Tactic Name: sm80_xmma_fprop_implicit_gemm_indexed_wo_smem_f16f16_f16f16_f16_nhwckrsc_nhwc_tilesize128x32x16_stage1_warpsize4x1x1_g1_tensor16x8x16_aligna4_alignc2 Tactic: 0xfd9154884033cd52 Time: 0.0142898
[05/19/2024-17:32:55] [V] [TRT] Tactic Name: sm80_xmma_fprop_implicit_gemm_indexed_wo_smem_f16f16_f16f16_f16_nhwckrsc_nhwc_tilesize128x32x64_stage1_warpsize4x1x1_g1_tensor16x8x16_aligna4_alignc4 Tactic: 0xa1c540a5038e4190 Time: 0.01192
[05/19/2024-17:32:55] [V] [TRT] Tactic Name: sm80_xmma_fprop_implicit_gemm_indexed_wo_smem_f16f16_f16f16_f16_nhwckrsc_nhwc_tilesize128x32x64_stage1_warpsize4x1x1_g1_tensor16x8x16_aligna8_alignc4 Tactic: 0xa47a4e5ec2ac6617 Time: 0.0112552
[05/19/2024-17:32:55] [V] [TRT] Tactic Name: sm80_xmma_fprop_implicit_gemm_indexed_wo_smem_f16f16_f16f16_f16_nhwckrsc_nhwc_tilesize128x16x64_stage1_warpsize4x1x1_g1_tensor16x8x16_aligna8_alignc8 Tactic: 0x112767cf498572ea Time: 0.00793311
[05/19/2024-17:32:55] [V] [TRT] Tactic Name: sm80_xmma_fprop_implicit_gemm_indexed_wo_smem_f16f16_f16f16_f16_nhwckrsc_nhwc_tilesize128x16x64_stage1_warpsize4x1x1_g1_tensor16x8x16_alignc4 Tactic: 0xa5a46bfbd719d757 Time: 0.00697078
[05/19/2024-17:32:55] [V] [TRT] Tactic Name: sm80_xmma_fprop_implicit_gemm_indexed_wo_smem_f16f16_f16f16_f16_nhwckrsc_nhwc_tilesize128x16x32_stage1_warpsize4x1x1_g1_tensor16x8x16_aligna4_alignc2 Tactic: 0x90e2d6b4ee50185b Time: 0.0127417
[05/19/2024-17:32:55] [V] [TRT] Tactic Name: sm80_xmma_fprop_implicit_gemm_indexed_wo_smem_f16f16_f16f16_f16_nhwckrsc_nhwc_tilesize128x16x32_stage1_warpsize4x1x1_g1_tensor16x8x16_aligna8_alignc4 Tactic: 0x1a092d9c78bdc1b4 Time: 0.0123733
[05/19/2024-17:32:55] [V] [TRT] Tactic Name: sm80_xmma_fprop_implicit_gemm_indexed_wo_smem_f16f16_f16f16_f16_nhwckrsc_nhwc_tilesize128x16x64_stage1_warpsize4x1x1_g1_tensor16x8x16_aligna4_alignc4 Tactic: 0x98e92db98836b738 Time: 0.00933571
[05/19/2024-17:32:55] [V] [TRT] Tactic Name: sm80_xmma_fprop_implicit_gemm_indexed_wo_smem_f16f16_f16f16_f16_nhwckrsc_nhwc_tilesize128x32x16_stage1_warpsize4x1x1_g1_tensor16x8x16_aligna2_alignc8 Tactic: 0x3507353e207bcdee Time: 0.0245463
[05/19/2024-17:32:55] [V] [TRT] Tactic Name: sm80_xmma_fprop_implicit_gemm_indexed_f16f16_f16f16_f16_nhwckrsc_nhwc_tilesize256x128x32_stage3_warpsize4x2x1_g1_tensor16x8x16 Tactic: 0xb17d53d15dfbfc9e Time: 0.0587764
[05/19/2024-17:32:55] [V] [TRT] Tactic Name: sm80_xmma_fprop_implicit_gemm_indexed_f16f16_f16f16_f16_nhwckrsc_nhwc_tilesize128x64x64_stage3_warpsize2x2x1_g1_tensor16x8x16 Tactic: 0x21b295c0c8f6c95a Time: 0.0310034
[05/19/2024-17:32:55] [V] [TRT] Tactic Name: sm80_xmma_fprop_implicit_gemm_indexed_f16f16_f16f16_f16_nhwckrsc_nhwc_tilesize64x32x64_stage5_warpsize2x2x1_g1_tensor16x8x16 Tactic: 0xe1ff5ad20f5c6bf6 Time: 0.0164104
[05/19/2024-17:32:55] [V] [TRT] Tactic Name: sm80_xmma_fprop_implicit_gemm_indexed_wo_smem_f16f16_f16f16_f16_nhwckrsc_nhwc_tilesize128x16x64_stage1_warpsize4x1x1_g1_tensor16x8x16_alignc2 Tactic: 0x2af09e2880d6293f Time: 0.00889412
[05/19/2024-17:32:55] [V] [TRT] Tactic Name: sm80_xmma_fprop_implicit_gemm_indexed_wo_smem_f16f16_f16f16_f16_nhwckrsc_nhwc_tilesize128x16x64_stage1_warpsize4x1x1_g1_tensor16x8x16_aligna8_alignc2 Tactic: 0x1202d6911edb6ed7 Time: 0.0103131
[05/19/2024-17:32:55] [V] [TRT] Tactic Name: sm80_xmma_fprop_implicit_gemm_indexed_f16f16_f16f16_f16_nhwckrsc_nhwc_tilesize256x64x32_stage3_warpsize4x1x1_g1_tensor16x8x16 Tactic: 0xa570c55d303796ff Time: 0.0315026
[05/19/2024-17:32:55] [V] [TRT] Tactic Name: sm80_xmma_fprop_implicit_gemm_indexed_f16f16_f16f16_f16_nhwckrsc_nhwc_tilesize64x64x64_stage4_warpsize2x2x1_g1_tensor16x8x16 Tactic: 0x4a81ea1e51436a30 Time: 0.0196891
[05/19/2024-17:32:55] [V] [TRT] Tactic Name: sm80_xmma_fprop_implicit_gemm_indexed_f16f16_f16f16_f16_nhwckrsc_nhwc_tilesize128x128x32_stage4_warpsize2x2x1_g1_tensor16x8x16 Tactic: 0x0e07ff4f4f7c1ac9 Time: 0.0330606
[05/19/2024-17:32:55] [V] [TRT] Tactic Name: sm80_xmma_fprop_implicit_gemm_indexed_wo_smem_f16f16_f16f16_f16_nhwckrsc_nhwc_tilesize128x32x16_stage1_warpsize4x1x1_g1_tensor16x8x16_aligna8_alignc2 Tactic: 0xf82e5a738111ead5 Time: 0.0255025
[05/19/2024-17:32:55] [V] [TRT] Tactic Name: sm80_xmma_fprop_implicit_gemm_indexed_f16f16_f16f16_f16_nhwckrsc_nhwc_tilesize128x64x32_stage5_warpsize2x2x1_g1_tensor16x8x16 Tactic: 0xc9d24bd069159fa8 Time: 0.0204382
[05/19/2024-17:32:55] [V] [TRT] Tactic Name: sm80_xmma_fprop_implicit_gemm_indexed_wo_smem_f16f16_f16f16_f16_nhwckrsc_nhwc_tilesize128x32x64_stage1_warpsize4x1x1_g1_tensor16x8x16_alignc8 Tactic: 0x1bf48a356bd0c083 Time: 0.00848807
[05/19/2024-17:32:55] [V] [TRT] Tactic Name: sm80_xmma_fprop_implicit_gemm_indexed_wo_smem_f16f16_f16f16_f16_nhwckrsc_nhwc_tilesize128x32x64_stage1_warpsize4x1x1_g1_tensor16x8x16_aligna2_alignc8 Tactic: 0xe607d4c03409bf44 Time: 0.0193074
[05/19/2024-17:32:55] [V] [TRT] Tactic Name: sm80_xmma_fprop_implicit_gemm_indexed_wo_smem_f16f16_f16f16_f16_nhwckrsc_nhwc_tilesize128x16x64_stage1_warpsize4x1x1_g1_tensor16x8x16_aligna2_alignc4 Tactic: 0x535afd51bf20abb9 Time: 0.0201509
[05/19/2024-17:32:55] [V] [TRT] Tactic Name: sm80_xmma_fprop_implicit_gemm_indexed_wo_smem_f16f16_f16f16_f16_nhwckrsc_nhwc_tilesize128x32x64_stage1_warpsize4x1x1_g1_tensor16x8x16_aligna4_alignc2 Tactic: 0x2e91b5765441bff8 Time: 0.0125455
[05/19/2024-17:32:55] [V] [TRT] Tactic Name: sm80_xmma_fprop_implicit_gemm_indexed_wo_smem_f16f16_f16f16_f16_nhwckrsc_nhwc_tilesize128x16x64_stage1_warpsize4x1x1_g1_tensor16x8x16_alignc8 Tactic: 0x29d52f76d7883502 Time: 0.00687391
[05/19/2024-17:32:55] [V] [TRT] Tactic Name: sm80_xmma_fprop_implicit_gemm_indexed_f16f16_f16f16_f16_nhwckrsc_nhwc_tilesize128x32x32_stage4_warpsize4x1x1_g1_tensor16x8x16 Tactic: 0xf79479a62ea9f901 Time: 0.0152526
[05/19/2024-17:32:55] [V] [TRT] Tactic Name: sm80_xmma_fprop_implicit_gemm_indexed_wo_smem_f16f16_f16f16_f16_nhwckrsc_nhwc_tilesize128x16x32_stage1_warpsize4x1x1_g1_tensor16x8x16_alignc4 Tactic: 0x7784aea08af37198 Time: 0.0102988
[05/19/2024-17:32:55] [V] [TRT] Tactic Name: sm80_xmma_fprop_implicit_gemm_indexed_wo_smem_f16f16_f16f16_f16_nhwckrsc_nhwc_tilesize128x16x32_stage1_warpsize4x1x1_g1_tensor16x8x16_aligna4_alignc8 Tactic: 0x93c767eab90e0466 Time: 0.011084
[05/19/2024-17:32:55] [V] [TRT] Tactic Name: sm80_xmma_fprop_implicit_gemm_indexed_wo_smem_f16f16_f16f16_f16_nhwckrsc_nhwc_tilesize128x16x32_stage1_warpsize4x1x1_g1_tensor16x8x16_aligna2_alignc8 Tactic: 0x5874b7028e1818e7 Time: 0.0174568
[05/19/2024-17:32:55] [V] [TRT] Tactic Name: sm80_xmma_fprop_implicit_gemm_indexed_wo_smem_f16f16_f16f16_f16_nhwckrsc_nhwc_tilesize128x16x32_stage1_warpsize4x1x1_g1_tensor16x8x16_aligna8_alignc8 Tactic: 0x96786911782c23e1 Time: 0.0121909
[05/19/2024-17:32:55] [V] [TRT] Tactic Name: sm80_xmma_fprop_implicit_gemm_indexed_f16f16_f16f16_f16_nhwckrsc_nhwc_tilesize128x256x32_stage3_warpsize2x4x1_g1_tensor16x8x16 Tactic: 0x7005d10718f6c22d Time: 0.0582705
[05/19/2024-17:32:55] [V] [TRT] Tactic Name: sm80_xmma_fprop_implicit_gemm_indexed_wo_smem_f16f16_f16f16_f16_nhwckrsc_nhwc_tilesize128x16x32_stage1_warpsize4x1x1_g1_tensor16x8x16_aligna2_alignc2 Tactic: 0x5b51065cd94604da Time: 0.0190897
[05/19/2024-17:32:55] [V] [TRT] Tactic Name: sm80_xmma_fprop_implicit_gemm_indexed_wo_smem_f16f16_f16f16_f16_nhwckrsc_nhwc_tilesize128x16x64_stage1_warpsize4x1x1_g1_tensor16x8x16_aligna2_alignc2 Tactic: 0xdc0e0882e8ef55d1 Time: 0.0205427
[05/19/2024-17:32:55] [V] [TRT] Tactic Name: sm80_xmma_fprop_implicit_gemm_indexed_wo_smem_f16f16_f16f16_f16_nhwckrsc_nhwc_tilesize128x32x16_stage1_warpsize4x1x1_g1_tensor16x8x16_aligna8_alignc4 Tactic: 0x777aafa0d6de14bd Time: 0.0245029
[05/19/2024-17:32:55] [V] [TRT] Tactic Name: sm80_xmma_fprop_implicit_gemm_indexed_wo_smem_f16f16_f16f16_f16_nhwckrsc_nhwc_tilesize128x32x16_stage1_warpsize4x1x1_g1_tensor16x8x16_aligna4_alignc4 Tactic: 0x72c5a15b17fc333a Time: 0.0142146
[05/19/2024-17:32:55] [V] [TRT] Tactic Name: sm80_xmma_fprop_implicit_gemm_indexed_f16f16_f16f16_f16_nhwckrsc_nhwc_tilesize64x128x32_stage5_warpsize2x2x1_g1_tensor16x8x16 Tactic: 0xafd1e8bf6bd3d638 Time: 0.0180554
[05/19/2024-17:32:55] [V] [TRT] Tactic Name: sm80_xmma_fprop_implicit_gemm_indexed_wo_smem_f16f16_f16f16_f16_nhwckrsc_nhwc_tilesize128x16x32_stage1_warpsize4x1x1_g1_tensor16x8x16_aligna4_alignc4 Tactic: 0x1fb62367b99fe633 Time: 0.0109584
[05/19/2024-17:32:55] [V] [TRT] Tactic Name: sm80_xmma_fprop_implicit_gemm_indexed_wo_smem_f16f16_f16f16_f16_nhwckrsc_nhwc_tilesize128x16x32_stage1_warpsize4x1x1_g1_tensor16x8x16_aligna8_alignc2 Tactic: 0x955dd84f2f723fdc Time: 0.012112
[05/19/2024-17:32:55] [V] [TRT] Tactic Name: sm80_xmma_fprop_implicit_gemm_indexed_wo_smem_f16f16_f16f16_f16_nhwckrsc_nhwc_tilesize128x32x64_stage1_warpsize4x1x1_g1_tensor16x8x16_aligna4_alignc8 Tactic: 0x2db40428031fa3c5 Time: 0.0115204
[05/19/2024-17:32:55] [V] [TRT] Tactic Name: sm80_xmma_fprop_implicit_gemm_indexed_f16f16_f16f16_f16_nhwckrsc_nhwc_tilesize128x128x64_stage3_warpsize2x2x1_g1_tensor16x8x16 Tactic: 0x866e7a5f6401b67f Time: 0.0572952
[05/19/2024-17:32:55] [V] [TRT] /conv1/Conv + /relu/Relu (CaskConvolution[0x80000009]) profiling completed in 0.110549 seconds. Fastest Tactic: 0x29d52f76d7883502 Time: 0.00687391
[05/19/2024-17:32:55] [V] [TRT] --------------- Timing Runner: /conv1/Conv + /relu/Relu (CaskFlattenConvolution[0x80000036])
[05/19/2024-17:32:55] [V] [TRT] CaskFlattenConvolution has no valid tactics for this config, skipping
[05/19/2024-17:32:55] [V] [TRT] >>>>>>>>>>>>>>> Chose Runner Type: CaskConvolution Tactic: 0x29d52f76d7883502
[05/19/2024-17:32:55] [V] [TRT] =============== Computing costs for /maxpool/MaxPool
[05/19/2024-17:32:55] [V] [TRT] *************** Autotuning format combination: Float(16384,256,16,1) -> Float(4096,64,8,1) ***************
[05/19/2024-17:32:55] [V] [TRT] --------------- Timing Runner: /maxpool/MaxPool (CudnnPooling[0x80000005])
[05/19/2024-17:32:55] [V] [TRT] CudnnPooling has no valid tactics for this config, skipping
[05/19/2024-17:32:55] [V] [TRT] --------------- Timing Runner: /maxpool/MaxPool (CaskPooling[0x8000002f])
[05/19/2024-17:32:55] [V] [TRT] Tactic Name: sm50_xmma_pooling_tiled_FP32NCHW_kMAX_tP7_tQ28_tR3_tS3_tU2_tV2_tUnroll1_tThreads855 Tactic: 0xf86a4e1f189f4821 Time: 0.00279877
[05/19/2024-17:32:55] [V] [TRT] Tactic Name: sm50_xmma_pooling_tiled_FP32NCHW_kMAX_tP4_tQ56_tR3_tS3_tU2_tV2_tUnroll5_tThreads1017 Tactic: 0x7b9e5e445528b90a Time: 0.0027709
[05/19/2024-17:32:55] [V] [TRT] Tactic Name: sm50_xmma_pooling_tiled_FP32NCHW_kMAX_tP14_tQ14_tR3_tS3_tU2_tV2_tUnroll2_tThreads841 Tactic: 0xdcecadaa3ad74a2c Time: 0.00236433
[05/19/2024-17:32:55] [V] [TRT] Tactic Name: sm50_xmma_pooling_tiled_FP32NCHW_kMAX_tP14_tQ14_tR3_tS3_tU2_tV2_tUnroll5_tThreads841 Tactic: 0x7bd883ae684d33e0 Time: 0.00277732
[05/19/2024-17:32:55] [V] [TRT] Tactic Name: sm50_xmma_pooling_tiled_FP32NCHW_kMAX_tP3_tQ56_tR3_tS3_tU2_tV2_tUnroll4_tThreads791 Tactic: 0xa23e43dae6aa4fa6 Time: 0.00250388
[05/19/2024-17:32:55] [V] [TRT] Tactic Name: sm50_xmma_pooling_tiled_FP32NCHW_kMAX_tP7_tQ28_tR3_tS3_tU2_tV2_tUnroll4_tThreads855 Tactic: 0x76d52bcd240dc832 Time: 0.00261793
[05/19/2024-17:32:55] [V] [TRT] Tactic Name: sm50_xmma_pooling_nd_NCDHW_kMAX_kGENERIC_3D_POOLING_MODE_kFLOAT_0 Tactic: 0x5faf4a0a8a5670ed Time: 0.00276985
[05/19/2024-17:32:55] [V] [TRT] Tactic Name: sm50_xmma_pooling_tiled_FP32NCHW_kMAX_tP7_tQ7_tR3_tS3_tU2_tV2_tUnroll6_tThreads225 Tactic: 0xdb90d0acdc9fc4e1 Time: 0.00233165
[05/19/2024-17:32:55] [V] [TRT] Tactic Name: sm50_xmma_pooling_tiled_FP32NCHW_kMAX_tP4_tQ56_tR3_tS3_tU2_tV2_tUnroll1_tThreads1017 Tactic: 0x4cf88ed475f74f6e Time: 0.00290852
[05/19/2024-17:32:55] [V] [TRT] Tactic Name: sm50_xmma_pooling_tiled_FP32NCHW_kMAX_tP3_tQ56_tR3_tS3_tU2_tV2_tUnroll6_tThreads791 Tactic: 0x8bb5080c88a2b679 Time: 0.00273432
[05/19/2024-17:32:55] [V] [TRT] Tactic Name: sm50_xmma_pooling_tiled_FP32NCHW_kMAX_tP4_tQ28_tR3_tS3_tU2_tV2_tUnroll3_tThreads513 Tactic: 0xcb3875826530ea38 Time: 0.00220596
[05/19/2024-17:32:55] [V] [TRT] Tactic Name: sm50_xmma_pooling_tiled_FP32NCHW_kMAX_tP7_tQ7_tR3_tS3_tU2_tV2_tUnroll4_tThreads225 Tactic: 0xf21b9b7ab2973d3e Time: 0.00221489
[05/19/2024-17:32:55] [V] [TRT] Tactic Name: sm50_xmma_pooling_tiled_FP32NCHW_kMAX_custom_tP4_tQ32_tRS3_tUV2 Tactic: 0x2639d3932b27ac67 Time: 0.00232877
[05/19/2024-17:32:55] [V] [TRT] Tactic Name: sm50_xmma_pooling_tiled_FP32NCHW_kMAX_tP7_tQ8_tR3_tS3_tU2_tV2_tUnroll4_tThreads255 Tactic: 0xfcb5fcaa68fff7ac Time: 0.00221004
[05/19/2024-17:32:55] [V] [TRT] Tactic Name: sm50_xmma_pooling_tiled_FP32NCHW_kMAX_tP7_tQ28_tR3_tS3_tU2_tV2_tUnroll6_tThreads855 Tactic: 0x5f5e601b4a0531ed Time: 0.00291273
[05/19/2024-17:32:55] [V] [TRT] Tactic Name: sm50_xmma_pooling_tiled_FP32NCHW_kMAX_tP7_tQ8_tR3_tS3_tU2_tV2_tUnroll1_tThreads255 Tactic: 0x720a9978546d77bf Time: 0.00213356
[05/19/2024-17:32:55] [V] [TRT] Tactic Name: sm50_xmma_pooling_tiled_FP32NCHW_kMAX_tP4_tQ56_tR3_tS3_tU2_tV2_tUnroll4_tThreads1017 Tactic: 0x7647ea605d1f4493 Time: 0.00263971
[05/19/2024-17:32:55] [V] [TRT] Tactic Name: sm50_xmma_pooling_tiled_FP32NCHW_kMAX_tP7_tQ28_tR3_tS3_tU2_tV2_tUnroll3_tThreads855 Tactic: 0xd1e105c97697b1fe Time: 0.00248733
[05/19/2024-17:32:55] [V] [TRT] Tactic Name: sm50_xmma_pooling_tiled_FP32NCHW_kMAX_tP7_tQ7_tR3_tS3_tU2_tV2_tUnroll1_tThreads225 Tactic: 0x7ca4fea88e05bd2d Time: 0.00224157
[05/19/2024-17:32:55] [V] [TRT] Tactic Name: sm50_xmma_pooling_tiled_FP32NCHW_kMAX_tP14_tQ14_tR3_tS3_tU2_tV2_tUnroll1_tThreads841 Tactic: 0x28ce1402b45cc05e Time: 0.00223257
[05/19/2024-17:32:55] [V] [TRT] Tactic Name: sm50_xmma_pooling_tiled_FP32NCHW_kMAX_tP7_tQ8_tR3_tS3_tU2_tV2_tUnroll6_tThreads255 Tactic: 0xd53eb77c06f70e73 Time: 0.00233253
[05/19/2024-17:32:55] [V] [TRT] Tactic Name: sm50_xmma_pooling_tiled_FP32NCHW_kMAX_tP7_tQ7_tR3_tS3_tU2_tV2_tUnroll3_tThreads225 Tactic: 0x552fb57ee00d44f2 Time: 0.00227947
[05/19/2024-17:32:55] [V] [TRT] Tactic Name: sm50_xmma_pooling_tiled_FP32NCHW_kMAX_tP14_tQ14_tR3_tS3_tU2_tV2_tUnroll6_tThreads841 Tactic: 0x8ffa3a06e6c6b992 Time: 0.003034
[05/19/2024-17:32:55] [V] [TRT] Tactic Name: sm50_xmma_pooling_tiled_FP32NCHW_kMAX_tP4_tQ56_tR3_tS3_tU2_tV2_tUnroll6_tThreads1017 Tactic: 0x6df482284d70bfa1 Time: 0.00303514
[05/19/2024-17:32:55] [V] [TRT] Tactic Name: sm50_xmma_pooling_tiled_FP32NCHW_kMAX_tP4_tQ28_tR3_tS3_tU2_tV2_tUnroll2_tThreads513 Tactic: 0x169187fc85b39995 Time: 0.00219984
[05/19/2024-17:32:55] [V] [TRT] Tactic Name: sm50_xmma_pooling_tiled_FP32NCHW_kMAX_tP7_tQ8_tR3_tS3_tU2_tV2_tUnroll5_tThreads255 Tactic: 0x211c0ed4887c8401 Time: 0.00223486
[05/19/2024-17:32:55] [V] [TRT] Tactic Name: sm50_xmma_pooling_tiled_FP32NCHW_kMAX_tP4_tQ56_tR3_tS3_tU2_tV2_tUnroll2_tThreads1017 Tactic: 0x5a9252b86daf49c5 Time: 0.00234537
[05/19/2024-17:32:55] [V] [TRT] Tactic Name: sm50_xmma_pooling_tiled_FP32NCHW_kMAX_tP14_tQ14_tR3_tS3_tU2_tV2_tUnroll3_tThreads841 Tactic: 0x01455fd4da543981 Time: 0.00251252
[05/19/2024-17:32:55] [V] [TRT] Tactic Name: sm50_xmma_pooling_fw_4d_FP32FP32NCHW_Max Tactic: 0xb59f9cfb90407c92 Time: 0.00289728
[05/19/2024-17:32:55] [V] [TRT] Tactic Name: sm50_xmma_pooling_tiled_FP32NCHW_kMAX_tP4_tQ28_tR3_tS3_tU2_tV2_tUnroll1_tThreads513 Tactic: 0xe2b33e540b3813e7 Time: 0.00222966
[05/19/2024-17:32:55] [V] [TRT] Tactic Name: sm50_xmma_pooling_tiled_FP32NCHW_kMAX_tP4_tQ28_tR3_tS3_tU2_tV2_tUnroll5_tThreads513 Tactic: 0xb1a5a9f8d729e059 Time: 0.0023725
[05/19/2024-17:32:55] [V] [TRT] Tactic Name: sm50_xmma_pooling_tiled_FP32NCHW_kMAX_tP3_tQ56_tR3_tS3_tU2_tV2_tUnroll2_tThreads791 Tactic: 0xd8a39fa054b345c7 Time: 0.00291456
[05/19/2024-17:32:55] [V] [TRT] Tactic Name: sm50_xmma_pooling_tiled_FP32NCHW_kMAX_tP7_tQ8_tR3_tS3_tU2_tV2_tUnroll2_tThreads255 Tactic: 0x862820d0dae6fdcd Time: 0.00210087
[05/19/2024-17:32:55] [V] [TRT] Tactic Name: sm50_xmma_pooling_tiled_FP32NCHW_kMAX_tP3_tQ56_tR3_tS3_tU2_tV2_tUnroll1_tThreads791 Tactic: 0x2c812608da38cfb5 Time: 0.0034004
[05/19/2024-17:32:55] [V] [TRT] Tactic Name: sm50_xmma_pooling_tiled_FP32NCHW_kMAX_tP4_tQ28_tR3_tS3_tU2_tV2_tUnroll4_tThreads513 Tactic: 0x6c0c5b8637aa93f4 Time: 0.00234357
[05/19/2024-17:32:55] [V] [TRT] Tactic Name: sm50_xmma_pooling_tiled_FP32NCHW_kMAX_tP3_tQ56_tR3_tS3_tU2_tV2_tUnroll5_tThreads791 Tactic: 0x7f97b1a406293c0b Time: 0.00263256
[05/19/2024-17:32:55] [V] [TRT] Tactic Name: sm50_xmma_pooling_tiled_FP32NCHW_kMAX_tP7_tQ28_tR3_tS3_tU2_tV2_tUnroll5_tThreads855 Tactic: 0xab7cd9b3c48ebb9f Time: 0.00276871
[05/19/2024-17:32:55] [V] [TRT] Tactic Name: sm50_xmma_pooling_tiled_FP32NCHW_kMAX_tP4_tQ28_tR3_tS3_tU2_tV2_tUnroll6_tThreads513 Tactic: 0x4587105059a26a2b Time: 0.00248229
[05/19/2024-17:32:55] [V] [TRT] Tactic Name: sm50_xmma_pooling_tiled_FP32NCHW_kMAX_tP7_tQ7_tR3_tS3_tU2_tV2_tUnroll2_tThreads225 Tactic: 0x88864700008e375f Time: 0.00221855
[05/19/2024-17:32:55] [V] [TRT] Tactic Name: sm50_xmma_pooling_tiled_FP32NCHW_kMAX_tP4_tQ56_tR3_tS3_tU2_tV2_tUnroll3_tThreads1017 Tactic: 0x574be69c6598b45c Time: 0.00249403
[05/19/2024-17:32:55] [V] [TRT] Tactic Name: sm50_xmma_pooling_tiled_FP32NCHW_kMAX_tP3_tQ56_tR3_tS3_tU2_tV2_tUnroll3_tThreads791 Tactic: 0x050a6ddeb430366a Time: 0.00240724
[05/19/2024-17:32:55] [V] [TRT] Tactic Name: sm50_xmma_pooling_tiled_FP32NCHW_kMAX_tP7_tQ28_tR3_tS3_tU2_tV2_tUnroll2_tThreads855 Tactic: 0x0c48f7b79614c253 Time: 0.00236043
[05/19/2024-17:32:55] [V] [TRT] Tactic Name: sm50_xmma_pooling_tiled_FP32NCHW_kMAX_tP7_tQ8_tR3_tS3_tU2_tV2_tUnroll3_tThreads255 Tactic: 0x5b81d2ae3a658e60 Time: 0.00216485
[05/19/2024-17:32:55] [V] [TRT] Tactic Name: sm50_xmma_pooling_tiled_FP32NCHW_kMAX_tP7_tQ7_tR3_tS3_tU2_tV2_tUnroll5_tThreads225 Tactic: 0x2fb2690452144e93 Time: 0.00226679
[05/19/2024-17:32:55] [V] [TRT] Tactic Name: sm50_xmma_pooling_tiled_FP32NCHW_kMAX_tP14_tQ14_tR3_tS3_tU2_tV2_tUnroll4_tThreads841 Tactic: 0xa67171d088ce404d Time: 0.00264162
[05/19/2024-17:32:55] [V] [TRT] /maxpool/MaxPool (CaskPooling[0x8000002f]) profiling completed in 0.107463 seconds. Fastest Tactic: 0x862820d0dae6fdcd Time: 0.00210087
[05/19/2024-17:32:55] [V] [TRT] >>>>>>>>>>>>>>> Chose Runner Type: CaskPooling Tactic: 0x862820d0dae6fdcd
[05/19/2024-17:32:55] [V] [TRT] *************** Autotuning format combination: Float(4096,1:4,256,16) -> Float(1024,1:4,128,16) ***************
[05/19/2024-17:32:55] [V] [TRT] --------------- Timing Runner: /maxpool/MaxPool (CaskPooling[0x8000002f])
[05/19/2024-17:32:55] [V] [TRT] Tactic Name: sm50_xmma_pooling_max_nhwc_FP32FP32_WINDOWSIZE_0_NOT_PROPAGATE_NAN_3D Tactic: 0xfa211b1cdd504de0 Time: 0.00320396
[05/19/2024-17:32:55] [V] [TRT] Tactic Name: sm50_xmma_pooling_max_nhwc_FP32FP32_WINDOWSIZE_3_PROPAGATE_NAN_3D Tactic: 0xe9d01a2a900075cb Time: 0.00385829
[05/19/2024-17:32:55] [V] [TRT] Tactic Name: sm50_xmma_pooling_max_nhwc_FP32FP32_WINDOWSIZE_0_NOT_PROPAGATE_NAN_2D Tactic: 0xaec8628e8180bced Time: 0.00317582
[05/19/2024-17:32:55] [V] [TRT] Tactic Name: sm50_xmma_pooling_max_nhwc_FP32FP32_WINDOWSIZE_0_PROPAGATE_NAN_3D Tactic: 0xd76bac5638836f8a Time: 0.00353516
[05/19/2024-17:32:55] [V] [TRT] Tactic Name: sm50_xmma_pooling_max_nhwc_FP32FP32_WINDOWSIZE_0_PROPAGATE_NAN_2D Tactic: 0x8382d5c464539e87 Time: 0.00345818
[05/19/2024-17:32:55] [V] [TRT] Tactic Name: sm50_xmma_pooling_fw_4d_FP32FP32NHWC_Max_CAlign4 Tactic: 0x22fb1bb4a70e340d Time: 0.00290331
[05/19/2024-17:32:55] [V] [TRT] Tactic Name: sm50_xmma_pooling_max_nhwc_FP32FP32_WINDOWSIZE_3_NOT_PROPAGATE_NAN_3D Tactic: 0x2c7251cbae30cf74 Time: 0.00373615
[05/19/2024-17:32:55] [V] [TRT] Tactic Name: sm50_xmma_pooling_max_nhwc_FP32FP32_WINDOWSIZE_3_NOT_PROPAGATE_NAN_2D Tactic: 0x789b2859f2e03e79 Time: 0.00252808
[05/19/2024-17:32:55] [V] [TRT] Tactic Name: sm50_xmma_pooling_max_nhwc_FP32FP32_WINDOWSIZE_3_PROPAGATE_NAN_2D Tactic: 0xbd3963b8ccd084c6 Time: 0.00304632
[05/19/2024-17:32:55] [V] [TRT] /maxpool/MaxPool (CaskPooling[0x8000002f]) profiling completed in 0.0201908 seconds. Fastest Tactic: 0x789b2859f2e03e79 Time: 0.00252808
[05/19/2024-17:32:55] [V] [TRT] >>>>>>>>>>>>>>> Chose Runner Type: CaskPooling Tactic: 0x789b2859f2e03e79
[05/19/2024-17:32:55] [V] [TRT] *************** Autotuning format combination: Half(16384,256,16,1) -> Half(4096,64,8,1) ***************
[05/19/2024-17:32:55] [V] [TRT] --------------- Timing Runner: /maxpool/MaxPool (CudnnPooling[0x80000005])
[05/19/2024-17:32:55] [V] [TRT] CudnnPooling has no valid tactics for this config, skipping
[05/19/2024-17:32:55] [V] [TRT] --------------- Timing Runner: /maxpool/MaxPool (CaskPooling[0x8000002f])
[05/19/2024-17:32:55] [V] [TRT] Tactic Name: sm50_xmma_pooling_fw_4d_FP16FP32NCHW_Max Tactic: 0xfd3a631f5c3e741e Time: 0.00290697
[05/19/2024-17:32:55] [V] [TRT] Tactic Name: sm50_xmma_pooling_nd_NCDHW_kMAX_kGENERIC_3D_POOLING_MODE_kHALF_0 Tactic: 0x457fb0a334d63ae2 Time: 0.00276255
[05/19/2024-17:32:55] [V] [TRT] /maxpool/MaxPool (CaskPooling[0x8000002f]) profiling completed in 0.00481343 seconds. Fastest Tactic: 0x457fb0a334d63ae2 Time: 0.00276255
[05/19/2024-17:32:55] [V] [TRT] >>>>>>>>>>>>>>> Chose Runner Type: CaskPooling Tactic: 0x457fb0a334d63ae2
[05/19/2024-17:32:55] [V] [TRT] *************** Autotuning format combination: Half(8192,256:2,16,1) -> Half(2048,64:2,8,1) ***************
[05/19/2024-17:32:55] [V] [TRT] --------------- Timing Runner: /maxpool/MaxPool (CaskPooling[0x8000002f])
[05/19/2024-17:32:55] [V] [TRT] Tactic Name: sm50_xmma_pooling_tiled_FP16NCxHW2_kMAX_tP7_tQ7_tR3_tS3_tU2_tV2_tUnroll6_tThreads225 Tactic: 0xf3e9cf42a99f3795 Time: 0.00249238
[05/19/2024-17:32:55] [V] [TRT] Tactic Name: sm50_xmma_pooling_tiled_FP16NCxHW2_kMAX_tP7_tQ8_tR3_tS3_tU2_tV2_tUnroll4_tThreads255 Tactic: 0xd4cce3441dff04d8 Time: 0.00228992
[05/19/2024-17:32:55] [V] [TRT] Tactic Name: sm50_xmma_pooling_tiled_FP16NCxHW2_kMAX_tP7_tQ28_tR3_tS3_tU2_tV2_tUnroll6_tThreads855 Tactic: 0xc6bc120243694257 Time: 0.00315677
[05/19/2024-17:32:55] [V] [TRT] Tactic Name: sm50_xmma_pooling_tiled_FP16NCxHW2_kMAX_tP4_tQ56_tR3_tS3_tU2_tV2_tUnroll6_tThreads1017 Tactic: 0x218865d927f56a76 Time: 0.00319116
[05/19/2024-17:32:55] [V] [TRT] Tactic Name: sm50_xmma_pooling_tiled_FP16NCxHW2_kMAX_tP7_tQ28_tR3_tS3_tU2_tV2_tUnroll5_tThreads855 Tactic: 0x329eabaacde2c825 Time: 0.00292618
[05/19/2024-17:32:55] [V] [TRT] Tactic Name: sm50_xmma_pooling_tiled_FP16NCxHW2_kMAX_tP14_tQ14_tR3_tS3_tU2_tV2_tUnroll4_tThreads841 Tactic: 0xea0d9621e24b959a Time: 0.00277161
[05/19/2024-17:32:55] [V] [TRT] Tactic Name: sm50_xmma_pooling_tiled_FP16NCxHW2_kMAX_tP3_tQ56_tR3_tS3_tU2_tV2_tUnroll4_tThreads791 Tactic: 0x3bdc31c3efc63c1c Time: 0.00263464
[05/19/2024-17:32:55] [V] [TRT] Tactic Name: sm50_xmma_pooling_tiled_FP16NCxHW2_kMAX_tP7_tQ28_tR3_tS3_tU2_tV2_tUnroll3_tThreads855 Tactic: 0x480377d07ffbc244 Time: 0.00257429
[05/19/2024-17:32:55] [V] [TRT] Tactic Name: sm50_xmma_pooling_tiled_FP16NCxHW2_kMAX_tP3_tQ56_tR3_tS3_tU2_tV2_tUnroll3_tThreads791 Tactic: 0x9ce81fc7bd5c45d0 Time: 0.00249537
[05/19/2024-17:32:55] [V] [TRT] Tactic Name: sm50_xmma_pooling_tiled_FP16NCxHW2_kMAX_tP3_tQ56_tR3_tS3_tU2_tV2_tUnroll2_tThreads791 Tactic: 0x4141edb95ddf367d Time: 0.00235931
[05/19/2024-17:32:55] [V] [TRT] Tactic Name: sm50_xmma_pooling_tiled_FP16NCxHW2_kMAX_tP4_tQ56_tR3_tS3_tU2_tV2_tUnroll1_tThreads1017 Tactic: 0x008469251f729ab9 Time: 0.00228521
[05/19/2024-17:32:55] [V] [TRT] Tactic Name: sm50_xmma_pooling_tiled_FP16NCxHW2_kMAX_tP14_tQ14_tR3_tS3_tU2_tV2_tUnroll1_tThreads841 Tactic: 0x64b2f3f3ded91589 Time: 0.00223051
[05/19/2024-17:32:55] [V] [TRT] Tactic Name: sm50_xmma_pooling_tiled_FP16NCxHW2_kMAX_tP4_tQ56_tR3_tS3_tU2_tV2_tUnroll5_tThreads1017 Tactic: 0x37e2b9b53fad6cdd Time: 0.00303961
[05/19/2024-17:32:55] [V] [TRT] Tactic Name: sm50_xmma_pooling_tiled_FP16NCxHW2_kMAX_tP4_tQ28_tR3_tS3_tU2_tV2_tUnroll6_tThreads513 Tactic: 0xdc65624950ce1991 Time: 0.00264652
[05/19/2024-17:32:55] [V] [TRT] Tactic Name: sm50_xmma_pooling_tiled_FP16NCxHW2_kMAX_tP7_tQ8_tR3_tS3_tU2_tV2_tUnroll6_tThreads255 Tactic: 0xfd47a89273f7fd07 Time: 0.0024093
[05/19/2024-17:32:55] [V] [TRT] Tactic Name: sm50_xmma_pooling_tiled_FP16NCxHW2_kMAX_tP7_tQ7_tR3_tS3_tU2_tV2_tUnroll4_tThreads225 Tactic: 0xda628494c797ce4a Time: 0.00276211
[05/19/2024-17:32:55] [V] [TRT] Tactic Name: sm50_xmma_pooling_tiled_FP16NCxHW2_kMAX_tP4_tQ28_tR3_tS3_tU2_tV2_tUnroll4_tThreads513 Tactic: 0xf5ee299f3ec6e04e Time: 0.00309505
[05/19/2024-17:32:55] [V] [TRT] Tactic Name: sm50_xmma_pooling_CHWPacked_NCxHW2_kMAX Tactic: 0xc8ae100b63fd8921 Time: 0.00307978
[05/19/2024-17:32:55] [V] [TRT] Tactic Name: sm50_xmma_pooling_tiled_FP16NCxHW2_kMAX_tP7_tQ28_tR3_tS3_tU2_tV2_tUnroll1_tThreads855 Tactic: 0x61883c0611f33b9b Time: 0.00297848
[05/19/2024-17:32:55] [V] [TRT] Tactic Name: sm50_xmma_pooling_tiled_FP16NCxHW2_kMAX_tP14_tQ14_tR3_tS3_tU2_tV2_tUnroll5_tThreads841 Tactic: 0x37a4645f02c8e637 Time: 0.00303305
[05/19/2024-17:32:55] [V] [TRT] Tactic Name: sm50_xmma_pooling_tiled_FP16NCxHW2_kMAX_tP3_tQ56_tR3_tS3_tU2_tV2_tUnroll1_tThreads791 Tactic: 0xb5635411d354bc0f Time: 0.00299181
[05/19/2024-17:32:55] [V] [TRT] Tactic Name: sm50_xmma_pooling_tiled_FP16NCxHW2_kMAX_tP7_tQ28_tR3_tS3_tU2_tV2_tUnroll4_tThreads855 Tactic: 0xef3759d42d61bb88 Time: 0.00299181
[05/19/2024-17:32:55] [V] [TRT] Tactic Name: sm50_xmma_pooling_tiled_FP16NCxHW2_kMAX_tP4_tQ28_tR3_tS3_tU2_tV2_tUnroll2_tThreads513 Tactic: 0x8f73f5e58cdfea2f Time: 0.00312974
[05/19/2024-17:32:55] [V] [TRT] Tactic Name: sm50_xmma_pooling_tiled_FP16NCxHW2_kMAX_tP7_tQ28_tR3_tS3_tU2_tV2_tUnroll2_tThreads855 Tactic: 0x95aa85ae9f78b1e9 Time: 0.00299257
[05/19/2024-17:32:55] [V] [TRT] Tactic Name: sm50_xmma_pooling_tiled_FP16NCxHW2_kMAX_tP7_tQ8_tR3_tS3_tU2_tV2_tUnroll3_tThreads255 Tactic: 0x73f8cd404f657d14 Time: 0.00309019
[05/19/2024-17:32:55] [V] [TRT] Tactic Name: sm50_xmma_pooling_tiled_FP16NCxHW2_kMAX_tP4_tQ28_tR3_tS3_tU2_tV2_tUnroll5_tThreads513 Tactic: 0x2847dbe1de4593e3 Time: 0.00315717
[05/19/2024-17:32:55] [V] [TRT] Tactic Name: sm50_xmma_pooling_tiled_FP16NCxHW2_kMAX_tP4_tQ56_tR3_tS3_tU2_tV2_tUnroll3_tThreads1017 Tactic: 0x1b37016d0f1d618b Time: 0.00278884
[05/19/2024-17:32:55] [V] [TRT] Tactic Name: sm50_xmma_pooling_tiled_FP16NCxHW2_kMAX_tP3_tQ56_tR3_tS3_tU2_tV2_tUnroll5_tThreads791 Tactic: 0xe675c3bd0f454fb1 Time: 0.00280112
[05/19/2024-17:32:55] [V] [TRT] Tactic Name: sm50_xmma_pooling_tiled_FP16NCxHW2_kMAX_tP4_tQ56_tR3_tS3_tU2_tV2_tUnroll4_tThreads1017 Tactic: 0x3a3b0d91379a9144 Time: 0.00279376
[05/19/2024-17:32:55] [V] [TRT] Tactic Name: sm50_xmma_pooling_tiled_FP16NCxHW2_kMAX_tP7_tQ8_tR3_tS3_tU2_tV2_tUnroll2_tThreads255 Tactic: 0xae513f3eafe60eb9 Time: 0.00214482
[05/19/2024-17:32:55] [V] [TRT] Tactic Name: sm50_xmma_pooling_tiled_FP16NCxHW2_kMAX_tP4_tQ56_tR3_tS3_tU2_tV2_tUnroll2_tThreads1017 Tactic: 0x16eeb549072a9c12 Time: 0.00246471
[05/19/2024-17:32:55] [V] [TRT] Tactic Name: sm50_xmma_pooling_tiled_FP16NCxHW2_kMAX_custom_tP4_tQ32_tRS3_tUV2 Tactic: 0x75514a5dc0a1648b Time: 0.00271888
[05/19/2024-17:32:55] [V] [TRT] Tactic Name: sm50_xmma_pooling_tiled_FP16NCxHW2_kMAX_tP14_tQ14_tR3_tS3_tU2_tV2_tUnroll3_tThreads841 Tactic: 0x4d39b825b0d1ec56 Time: 0.00262043
[05/19/2024-17:32:55] [V] [TRT] Tactic Name: sm50_xmma_pooling_tiled_FP16NCxHW2_kMAX_tP7_tQ7_tR3_tS3_tU2_tV2_tUnroll5_tThreads225 Tactic: 0x07cb76ea2714bde7 Time: 0.00240472
[05/19/2024-17:32:55] [V] [TRT] Tactic Name: sm50_xmma_pooling_tiled_FP16NCxHW2_kMAX_tP3_tQ56_tR3_tS3_tU2_tV2_tUnroll6_tThreads791 Tactic: 0x12577a1581cec5c3 Time: 0.00294624
[05/19/2024-17:32:55] [V] [TRT] Tactic Name: sm50_xmma_pooling_tiled_FP16NCxHW2_kMAX_tP14_tQ14_tR3_tS3_tU2_tV2_tUnroll6_tThreads841 Tactic: 0xc386ddf78c436c45 Time: 0.00317188
[05/19/2024-17:32:55] [V] [TRT] Tactic Name: sm50_xmma_pooling_tiled_FP16NCxHW2_kMAX_tP7_tQ7_tR3_tS3_tU2_tV2_tUnroll3_tThreads225 Tactic: 0x7d56aa90950db786 Time: 0.00223149
[05/19/2024-17:32:55] [V] [TRT] Tactic Name: sm50_xmma_pooling_tiled_FP16NCxHW2_kMAX_tP4_tQ28_tR3_tS3_tU2_tV2_tUnroll3_tThreads513 Tactic: 0x52da079b6c5c9982 Time: 0.0023003
[05/19/2024-17:32:55] [V] [TRT] Tactic Name: sm50_xmma_pooling_tiled_FP16NCxHW2_kMAX_tP7_tQ8_tR3_tS3_tU2_tV2_tUnroll1_tThreads255 Tactic: 0x5a738696216d84cb Time: 0.00229014
[05/19/2024-17:32:55] [V] [TRT] Tactic Name: sm50_xmma_pooling_tiled_FP16NCxHW2_kMAX_tP7_tQ7_tR3_tS3_tU2_tV2_tUnroll2_tThreads225 Tactic: 0xa0ff58ee758ec42b Time: 0.00304593
[05/19/2024-17:32:55] [V] [TRT] Tactic Name: sm50_xmma_pooling_tiled_FP16NCxHW2_kMAX_tP7_tQ7_tR3_tS3_tU2_tV2_tUnroll1_tThreads225 Tactic: 0x54dde146fb054e59 Time: 0.00321971
[05/19/2024-17:32:55] [V] [TRT] Tactic Name: sm50_xmma_pooling_tiled_FP16NCxHW2_kMAX_tP14_tQ14_tR3_tS3_tU2_tV2_tUnroll2_tThreads841 Tactic: 0x90904a5b50529ffb Time: 0.00294941
[05/19/2024-17:32:55] [V] [TRT] Tactic Name: sm50_xmma_pooling_tiled_FP16NCxHW2_kMAX_tP7_tQ8_tR3_tS3_tU2_tV2_tUnroll5_tThreads255 Tactic: 0x0965113afd7c7775 Time: 0.00301733
